,title,rating,price
1369,کتاب شکست پای امید روندگان سراب,3.95,18000
1370,کتاب گربه ایرانی در چکمه ایتالیایی,3.95,18000
1371,کتاب واسازی از تاریخ هنر تا ترک سیگار,3.95,18000
1372,کتاب در بیابان سحر فرا می رسد کسی این را می داند,3.95,18000
1373,کتاب با فرفره ها به شادی باد بگرد,3.95,18000
1374,کتاب گم شده در جنگل کلمات,3.95,18000
1375,کتاب بررسی مسایل جاری سازمان و مدیریت,3.95,18500
1376,کتاب پیله های من,3.95,18500
1377,کتاب شب یلدا,3.95,18750
1378,کتاب با ماه در آواز,3.95,19000
1379,دبیرستان بدترین سال های زندگی ام,3.95,19000
1380,کتاب طرح بازاریابی را چگونه آماده و اجرا کنیم,3.95,19000
1381,کتاب هفت خوان و خرده ای,3.95,19000
1382,کتاب دنیای کودکان تیزهوش 3,3.95,19000
1383,هدیه اکنون,3.95,19500
1384,کتاب نقد ادبی در ادبیات کلاسیک فارسی,3.95,19500
1385,لحظات بحرانی,3.95,20000
1386,کتاب خدا حفظتان کند آقای رزواتر,3.95,20000
1387,کتاب آموزش خط مقدماتی,3.95,20000
1388,کتاب دزد آذرخش,3.95,20000
1389,کتاب مهندسی فرایند دعا,3.95,20000
1390,کتاب ثروت سازی به سبک ژاپنی,3.95,20000
1391,کتاب مجموعه امنیتی قفقاز جنوبی,3.95,20000
1392,کتاب پوتار,3.95,20000
1393,کتاب تربیت فرزندان به روش (QBQ),3.95,20000
1394,کتاب دفتری بی نام,3.95,20000
1395,کتاب عصرانه های آسان,3.95,20000
1396,کتاب تحلیل چند متغیره گسسته,3.95,20000
1397,کتاب منشاء درد ما جای دورتری است,3.95,20000
1398,نامه هایی از یک دوست,3.95,20000
1399,کتاب تازه چه خبر؟,3.95,20000
1400,کتاب شیر کوچولو بازیگر می شود,3.95,20000
1401,کتاب از فاطمه به فاطمه (س),3.95,20000
1402,کتاب یک زندگی,3.95,20000
1403,کتاب آشنایی با تکنیک های خودگویی مثبت و خود کنترلی هیجانی,3.95,20000
1404,کتاب نه به پلاستیک بیشتر,3.95,20000
1405,کتاب اتل متل و بزغاله ها,3.95,20000
1406,کتاب ماری آنتوانت,3.95,20000
1407,کتاب نیست نیست,3.95,20000
1408,کتاب عکس یادگاری,3.95,20000
1409,کتاب چرا خدا به فیل خرطوم داده است؟,3.95,20000
1410,کتاب عدم,3.95,20000
1411,کتاب کلودومیر بداخلاق (سلطان صحنه),3.95,20000
1412,کتاب هتروتوپیای ایرانی,3.95,20000
1413,کتاب ماجرای غرق شدن,3.95,20000
1414,کتاب از رنج اشیاء,3.95,20000
1415,کتاب زنبورک طلایی,3.95,20000
1416,کتاب خروپف در خواب,3.95,21000
1417,جادوی معماها 2,3.95,21000
1418,کتاب سفر کسرا,3.95,21500
1419,کتاب از سیاست تا فرهنگ,3.95,21500
1420,زنان توانمند,3.95,21900
1421,کتاب بداهه سازی در تئاتر,3.95,22000
1422,کتاب جاده امن هور,3.95,22000
1423,کتاب زبان و ادب فارسی در قلمرو عثمانی,3.95,22000
1424,کتاب پناه,3.95,22000
1425,کتاب مگا خلاقیت,3.95,22500
1426,کتاب شب تاریک روح,3.95,22500
1427,کتاب مالیخولیای غزل,3.95,23000
1428,کتاب مقدمه ای بر جغرافیای سیاسی دریاها,3.95,23000
1429,کتاب دموکراسی و تعلیم و تربیت,3.95,23000
1430,کتاب نگاه کاغذی,3.95,23000
1431,کتاب جناح های سیاسی در جمهوری اسلامی ایران در دهه ی ۱۳۶۰,3.95,23000
1432,کتاب چه… چه,3.95,23000
1433,کتاب تاثیر جهان بینی توحیدی در دانش مدیریت,3.95,23000
1434,کتاب ناکجا و دو نمایشنامه دیگر,3.95,24000
1435,شمعدانی,3.95,24000
1436,داینای ترسو,3.95,24000
1437,کتاب دوره گرد,3.95,24000
1438,کتاب من عصبانی هستم,3.95,24000
1439,کتاب دانستنیهای جوانان در سرزمین قرآن,3.95,24500
1440,کتاب یک دو،ببند بند کفشاتو,3.95,24500
1441,کتاب ذن در هنر عکاسی خیابانی,3.95,24900
1442,کتاب خانه ای با شیروانی قرمز,3.95,25000
1443,کتاب عروسک فرنگی,3.95,25000
1444,کتاب خیاطی مادام,3.95,25000
1445,کتاب آثار علوی,3.95,25000
1446,کتاب منهای عشق,3.95,25000
1447,کتاب عروسک پدر,3.95,25000
1448,کتاب داستان یازده رخ,3.95,25000
1449,خلاقیت، فعالیت، سرگرمی 4,3.95,25000
1450,کتاب شکسته بسته ی لخته,3.95,25000
1451,کتاب میدان نبرد ذهن,3.95,25000
1452,کتاب بیوانفورماتیک به زبان ساده,3.95,25000
1453,کتاب اختراعات,3.95,25000
1454,آماتورها,3.95,25000
1455,کتاب پدیدار شناسی، هنر، مدرنیته,3.95,25000
1456,کتاب از صاعقه تا باران,3.94,1000
1457,کتاب چرا مردم از آمریکا متنفرند,3.94,1900
1458,کتاب مجموعۀ مصور تاریخ اسلام,3.94,2000
1459,کتاب نوازش خیال,3.94,2000
1460,کتاب رئیس جمهور و مسئولیت اجرای قانون اساسی (جلد دوم),3.94,2000
1461,کتاب برهنه ها و مرده ها,3.94,2000
1462,کتاب آموزه مهدویت در عرفان اسلامی,3.94,2200
1463,کتاب تراژدی آمریکایی,3.94,2500
1464,کتاب همیشه و انتظار,3.94,2600
1465,کتاب قصه های برگزیده از هزار و یک شب,3.94,3000
1466,کتاب برگزیده ی شعرهای پروین اعتصامی,3.94,3200
1467,کتاب ربات ها در حمل و نقل,3.94,3500
1468,کتاب اطلاعات و ارتباطات با رویکرد کارآفرینی,3.94,3500
1469,کتاب تاریخ ادبیات عرب,3.94,3900
1470,یک ساعت و نیم 3,3.94,4000
1471,کتاب پرده جهنم,3.94,4000
1472,کتاب گلچینی از آموزه های تربیتی,3.94,4000
1473,کتاب گرگ,3.94,4000
1474,کتاب صهیونیسم مسیحی و جایگاه آن در ایالات متحده آمریکا,3.94,4100
1475,کتاب ماجراهای یه کله,3.94,4200
1476,کتاب میان دست های تو سیب می شوم,3.94,5000
1477,کتاب بلوغ,3.94,5000
1478,کتاب نشانه شناسی ادبی,3.94,5000
1479,کتاب خواهر خونه,3.94,5000
1480,تفسیر کشاف,3.94,5000
1481,ماشین زمان,3.94,5300
1482,کتاب مورچه و درخت سیب,3.94,5500
1483,کتاب بعداز مگریت,3.94,5500
1484,کتاب سه فیلمنامه,3.94,5500
1485,کتاب قاتل,3.94,6000
1486,کتاب کارگردانی کمدی موقعیت,3.94,6000
1487,کلاغ های قیطریه,3.94,6000
1488,کتاب آجر,3.94,6500
1489,کتاب رشد اجتماعی کودک من,3.94,6500
1490,کتاب یک دشت دویدن,3.94,6500
1491,کتاب پس مانده های ناگوار,3.94,6500
1492,کتاب تماس,3.94,6600
1493,کتاب دنیای شگفت انگیز حشرات در زیر میکروسکوپ,3.94,7000
1494,کتاب با هم ماندن در دنیای فاصله ها,3.94,7000
1495,کتاب زناشویی و بارداری,3.94,7200
1496,کتاب مدیریت در عرصه فرهنگها مباحث و دیدگاهها,3.94,7300
1497,کتاب ادبیات گفتمان اسلامی در مکتب نهج البلاغه,3.94,7500
1498,کتاب تلخون و 4 داستان دیگر,3.94,7500
1499,کتاب شهریار، مرغ بهشتی,3.94,7500
1500,به یاد کاتالونیا,3.94,7500
1501,کتاب آشنایی با مغناطیس,3.94,7500
1502,کتاب سی گفتار,3.94,7500
1503,کتاب قصه های تصویری از تذکره الاولیا 2,3.94,7500
1504,کتاب وزن,3.94,8000
1505,کتاب پژوهشی در آیین وهابیت,3.94,8000
1506,کتاب انرژی را هدر ندهیم,3.94,8000
1507,کتاب شب به خیر داداش,3.94,8500
1508,کتاب داستان های امیل,3.94,8500
1509,کتاب شهید محلاتی,3.94,8500
1510,کتاب جوجو رو نیگا,3.94,8800
1511,کتاب خداحافظ برلین,3.94,9000
1512,کتاب جرم مطبوعاتی,3.94,9000
1513,کتاب آرام شب به خیر,3.94,9000
1514,کتاب سایه آسوریک,3.94,9000
1515,کتاب یار امام یاور رهبر,3.94,9000
1516,یازده نمایشنامه,3.94,9500
1517,کتاب سوء تفاهم در مسکو,3.94,9500
1518,کتاب رام کردن زن سرکش,3.94,9500
1519,کتاب احترام و اتکا به نفس,3.94,10000
1520,کتاب تلاوت آرامش 2,3.94,10000
1521,کتاب راهنمای ناکامل و نامعتبر هاگوارتز,3.94,10000
1522,کتاب ویترین جدید,3.94,10000
1523,عشق بی پایان,3.94,10000
1524,کتاب روزگاران طلایی تئاتر,3.94,10000
1525,کتاب نیکسی و بدبیاری های زمستانی,3.94,10000
1526,کتاب جنگ با مارمولک ها,3.94,10000
1527,قصه های تصویری از منطق الطیر 10,3.94,10000
1528,کتاب به این هم می گن تاریخ؟!,3.94,10000
1529,کتاب اعتماد سازی برای مدارس بهتر,3.94,10000
1530,کتاب دشت,3.94,10000
1531,کتاب استراتژی سامانه های مدیریت کیفیت،ایزوها و برندسازی,3.94,10000
1532,کتاب ساحل آرمانشهر( سفر),3.94,11000
1533,کتاب تمساح های رودخانه ی تامبونان,3.94,11000
1534,کتاب خوب بهتر از کامل,3.94,11000
1535,کتاب آنچه معلمان و مربیان باید بدانند,3.94,11000
1536,کتاب بیماریها و آفات کرم ابریشم و درخت توت,3.94,11000
1537,کتاب کفشم زمانی گاو بوده,3.94,11000
1538,کتاب در سپهر سپهری,3.94,12000
1539,کتاب چگونه از بدن انسان طراحی کنیم,3.94,12000
1540,کتاب عدالت و امنیت ملی,3.94,12000
1541,آخرین نفس,3.94,12000
1542,کتاب بندهای خالی,3.94,12000
1543,کتاب زمین مرده,3.94,12000
1544,کتاب یوکی فرشته ابر قهرمان,3.94,12000
1545,کتاب بود و بود و بود.... (2),3.94,12000
1546,کتاب ملانصرالدین فریب می خورد و یک حکایت دیگر,3.94,12000
1547,کتاب اخلاق در نهج البلاغه,3.94,12000
1548,کتاب کلوچه زنجبیلی به شکل آدمک,3.94,12000
1549,کتاب روستای من دوستای من,3.94,12000
1550,کتاب 	نام این پرنده چیست؟,3.94,12500
1551,کتاب دخترک خیالباف,3.94,12500
1552,کتاب دو گانه گرایی جوهری,3.94,12600
1553,کتاب کارکرد ابهام در فرایند خوانش متن,3.94,13000
1554,کتاب مدیریت پایدار علف های هرز,3.94,13000
1555,کتاب مشکل حکایتی ست,3.94,13000
1556,کتاب جنگ نرم 2,3.94,14000
1557,کتاب مدافعان شام,3.94,14000
1558,کتاب روایت مدرن و موج نوی سینمای ایران,3.94,14000
1559,کتاب جوجه تیغی های پسر عمو,3.94,14000
1560,کتاب صاعقه در صحرا,3.94,14000
1561,کتاب اسم من چفیه است,3.94,14000
1562,کتاب بهداشت من، سلامتی من,3.94,14000
1563,کتاب سوفی میلیونر,3.94,14000
1564,کتاب امام علی (ع) روشنگر هستی,3.94,14700
1565,کتاب خدا ما را دوست دارد,3.94,14900
1566,کتاب یکی بود،یکی نبود…,3.94,15000
1567,کتاب سفرهای اردک زیرک,3.94,15000
1568,کتاب بهار می رسد,3.94,15000
1569,کتاب درآمدی بر مطالعات جمعیتی,3.94,15000
1570,کتاب هیپنوتیزم به زبان ساده,3.94,15000
1571,سفرهای گالیور,3.94,15000
1572,کتاب دیوانه در مهتاب,3.94,15000
1573,ای خدا نگاهم کن,3.94,15000
1574,کتاب برنامه ریزی آموزش و پرورش,3.94,15000
1575,کتاب باغ گل محمدی (ص),3.94,15000
1576,دفترچه خاطرات یک بی عرضه 8,3.94,15000
1577,کتاب پادشاهی کیقباد,3.94,15000
1578,کتاب در خواب هایمان مردیم,3.94,15000
1579,کتاب بر بال باد,3.94,15000
1580,کتاب دکتر علی شریعتی,3.94,15000
1581,کتاب فروش و توزیع,3.94,15000
1582,کتاب نی نی خونه ما,3.94,15000
1583,کتاب نکته هایی درباره ی سلامتی,3.94,15000
1584,کتاب قرآن شناسی,3.94,15000
1585,کتاب فرهنگ افسانه های مردم ایران 16,3.94,16000
1586,کتاب پسران سفیدرود,3.94,16000
1587,تام سایر,3.94,16000
1588,کتاب دستی نرم، در خشونت سنگ...,3.94,16000
1589,کتاب عید اومده، عروسکا,3.94,16000
1590,کتاب دایره، بازتاب، تغییر شکل,3.94,17000
1591,کتاب خاطرات یک خنگول - جلد 1,3.94,17000
1592,کتاب آشنایی با سیستم های مخابراتی - مفاهیم اجرایی,3.94,17000
1593,مردی در تاریکی,3.94,17000
1594,کتاب آتش به اختیار,3.94,17000
1595,کتاب قصه ی ابر و باران,3.94,17000
1596,کتاب راهنمای کامل برای به راه آوردن آدم بزرگ ها,3.94,17000
1597,کتاب در گوش من گفت,3.94,17000
1598,کتاب بی عشق بی وطن,3.94,17500
1599,کاربردی ترین شیوه کسب ثروت در قرن معاصر,3.94,18000
1600,کتاب چگونه تاریخچه کمونیسم را برای بیماران روانی توضیح دهم؟,3.94,18000
1601,کتاب نمادهای فنگ شویی,3.94,18000
1602,کتاب مهر در خاور نزدیک و ایران باستان,3.94,18000
1603,کتاب امشب همین جا می خوابم,3.94,18000
1604,کتاب نجات دهنده به دوزخ خود برمی گردد,3.94,18000
1605,کتاب روشهای طراحی در مهندسی,3.94,18000
1606,کتاب بچه های خوش شانس کلاس نحس 6,3.94,18500
1607,کتاب آب در هنر دنیای باستان,3.94,18500
1608,کتاب حکایت بانوی آزرده,3.94,19000
1609,کتاب لاغر استخونی 2,3.94,19000
1610,کتاب آهن ربا و فنر,3.94,19000
1611,کتاب ماجراهای من و شیشی 1و2,3.94,19500
1612,کتاب بودای بزرگ کمکشان کن,3.94,20000
1613,کتاب پرنده مهاجر,3.94,20000
1614,نخستین عشق,3.94,20000
1615,کتاب جامعه شناسی رابطه اجتماعی,3.94,20000
1616,کتاب روندهای بنیادین در دانش زبان,3.94,20000
1617,کتاب غذای ماکارونی آسان,3.94,20000
1618,کتاب شرح خطبه امام حسین (ع) در منا,3.94,20000
1619,کتاب دختری که عاشق باد بود,3.94,20000
1620,کتاب بادبادک ها,3.94,20000
1621,کتاب حیوانات تغییر شکل دهنده در حیات وحش,3.94,20000
1622,کتاب این شهر تو را دوست ندارد,3.94,20000
1623,کتاب شوق زیستن 1,3.94,20000
1624,کتاب دمکراسی بازدارنده,3.94,20000
1625,کتاب دوست ندارم تنها باشم,3.94,20000
1626,کتاب دنیا با رنگ قشنگه 3,3.94,20000
1627,کتاب دنیا با رنگ قشنگه 6,3.94,20000
1628,کتاب ابراهیم خان,3.94,20000
1629,کتاب زنجیره تامین زیست توده,3.94,20000
1630,کتاب دیپلماسی گاز,3.94,20000
1631,آپولین پزشک می شود,3.94,20000
1632,کتاب الفبای طراحی سایت برای نوجوانان - سطح 1,3.94,20000
1633,کتاب یاری ساز حقوق جزای عمومی,3.94,20000
1634,کتاب اثر فرایند بر ایمنی و کیفیت مواد غذایی,3.94,20000
1635,کتاب آموزش اشکال و کلمات متضاد در انگلیسی,3.94,20000
1636,کتاب ادیسون,3.94,20000
1637,کتاب نامه ای به معشوقم,3.94,20000
1638,کتاب کشتی کوچولو,3.94,20000
1639,کتاب فلورینا و پرنده کوچک,3.94,20000
1640,کتاب رنگ آمیزی شازده کوچولو,3.94,20000
1641,کتاب فرهنگ افسانه های مردم ایران 15,3.94,21000
1642,کتاب روشنفکری و عرصه عمومی,3.94,21000
1643,کتاب لژیونر,3.94,21000
1644,کتاب شهر هرت,3.94,22000
1645,کتاب چی بپوشم؟,3.94,22000
1646,کتاب مهارت های زندگی,3.94,22000
1647,کتاب همه گفتند مرگ بر شاه,3.94,22000
1648,کتاب نینجا پیگیر می شود,3.94,22000
1649,کتاب جک و لوبیای سحرآمیز,3.94,22000
1650,کتاب پایان,3.94,22500
1651,کتاب امواج گرسنه,3.94,23000
1652,کتاب پوخه های برف,3.94,23000
1653,کتاب قصه روزنامجات عهد بوق,3.94,23000
1654,کتاب سید بغداد,3.94,23000
1655,کتاب امام شناسی,3.94,24000
1656,کتاب شهروند شهرهای داستانی,3.94,25000
1657,کتاب درمان شناختی - رفتاری کودکان، نوجوانان و خانواده ها,3.94,25000
1658,کتاب فعل و گروه فعلی و تحول آن در زبان فارسی,3.94,25000
1659,کتاب خشونت مشفقانه,3.94,25000
1660,کتاب نوادگان خورشید,3.94,25000
1661,کتاب دنیای متفاوت کلان داده و چارچوب هدوپ,3.94,25000
1662,کتاب هیل بیلی,3.94,25000
1663,کتاب کانت,3.94,25000
1664,کتاب زیارت عاشورا,3.93,800
1665,کتاب 60 نوع کیک، بیسکویت و شکلات خانگی,3.93,1000
1666,کتاب حکومت جهانی توسعه و امنیت انسانی,3.93,1300
1667,کتاب قوه قاهره,3.93,1500
1668,کتاب دیدار با فردا,3.93,1500
1669,سه تار,3.93,1500
1670,کتاب پسران تشمال,3.93,2000
1671,کتاب سید رضی مولف نهج البلاغه,3.93,2300
1672,کتاب تئاتر جزیره کوچک آزادی,3.93,2500
1673,کتاب معجزه واقعی در زندگی,3.93,2500
1674,کتاب قصه خاله رعنا و عمه نساء,3.93,2700
1675,کتاب آموزش مهارتهای والیبال,3.93,2800
1676,کتاب سه شنبه ای که برف می بارد بر شعر تو,3.93,3200
1677,کتاب من های متناقض,3.93,3200
1678,کتاب آزمایش ‏الکترونیک ‏برای ‏آموزش‏ اصول الکترونیک,3.93,3600
1679,کتاب سکته قبلی,3.93,3600
1680,گاو بنی اسرائیل,3.93,4000
1681,کتاب یازدۀ نه,3.93,4000
1682,کتاب خط بازی,3.93,4200
1683,کتاب هیاهوی کوهسار,3.93,4500
1684,کتاب درس های زندگی از فوتبال,3.93,5000
1685,کتاب گذر ساحران,3.93,5000
1686,کتاب روشنان شماره نوزدهم,3.93,5000
1687,دعای شریف ندبه,3.93,5000
1688,کتاب کیتی,3.93,5000
1689,کتاب مشاهیر کتابشناسی معاصر ایران (14),3.93,5000
1690,کتاب مشاهیر کتابشناسی معاصر ایران (7),3.93,5000
1691,کتاب درخت جارو,3.93,5200
1692,قلب روح,3.93,5300
1693,کتاب پرندگان,3.93,5500
1694,کتاب گلچین سخن,3.93,5500
1695,کتاب تو اینجا نیستی اما,3.93,6000
1696,کتاب بازی و باغ سیب,3.93,6000
1697,کتاب گزیده بوستان,3.93,6000
1698,کتاب تخم گذاری در جیب,3.93,6000
1699,کتاب تشپ کال,3.93,6000
1700,کتاب کاریکلماتور,3.93,6000
1701,کتاب وظایف تربیتی خانواده,3.93,6200
1702,کتاب کرد ها، ترک ها، عرب ها,3.93,6500
1703,کتاب فیل,3.93,6500
1704,کتاب غبار بر ماه,3.93,6800
1705,کتاب معراج شقایق,3.93,7000
1706,کتاب کتاب کوچک مصاحبه,3.93,7000
1707,کتاب مسابقه ی خرگوش و لاک پشت,3.93,7000
1708,کتاب خلوت مدیر,3.93,7000
1709,کتاب هفت لبخند هفت پیاده رو,3.93,7000
1710,کتاب نفری یک قاچ کیک تولد,3.93,7500
1711,24 ساعت در خواب و بیداری و 3 داستان دیگر,3.93,7500
1712,کتاب الگوی اسلامی مصرف,3.93,7500
1713,کتاب پسر طلا، دختر زمرد,3.93,7500
1714,کتاب برای تو و ماه نغمه سر دادم,3.93,7500
1715,کتاب بیخوابی,3.93,8000
1716,کتاب محو,3.93,8000
1717,کتاب هزارفرسنگ زیر دریا,3.93,8000
1718,کتاب خانه ی خاله,3.93,8000
1719,کتاب هندسه ی عصر حجری (مثلث),3.93,8000
1720,کتاب بال های دریا,3.93,8000
1721,کتاب منبع کنترل در مدیریت آموزشی,3.93,8000
1722,کتاب نجار شهر هیولاها,3.93,8000
1723,کتاب فرهنگ مکالمه زبان فرانسه,3.93,8500
1724,کتاب شکل گیری ملیت ایرانی,3.93,8500
1725,کتاب آمده بودی برای خداحافظی,3.93,8500
1726,کتاب مدیریت گردشگری و وجهه ی ملی,3.93,9000
1727,کتاب حقوق تجارت,3.93,9000
1728,کتاب درخت بلوط پایدار,3.93,9000
1729,کتاب گورستان نوزادان روشن فکر,3.93,9500
1730,کتاب طالع متولدین دی,3.93,9500
1731,کتاب سقراط,3.93,10000
1732,کتاب نمایشنامه ایرانی کمدی استشمامات,3.93,10000
1733,کتاب کنت ماتیاس ساندورف,3.93,10000
1734,کتاب دکتر آنته گیرت,3.93,10000
1735,کتاب خونه ی ما در انتظار نی نی,3.93,10000
1736,کتاب خشم و عصیان,3.93,10000
1737,کتاب طرز فکر، رفتار و شخصیت فرزندتان را متحول کنید,3.93,10000
1738,کتاب کو گوش شنوا,3.93,10000
1739,کتاب مداخله بشردوستانه و حقوق بین الملل,3.93,10000
1740,کتاب اودیسه,3.93,10000
1741,کتاب ساختار داستان سیاوش,3.93,10000
1742,کتاب پدر چرا توی خانه مانده است؟,3.93,10000
1743,کتاب دارد هوا که بخواند,3.93,10000
1744,کتاب فردا داستان خوبی می نویسم,3.93,10000
1745,کتاب تو می توانی دوست داشتنی باشی,3.93,10000
1746,کتاب پینوکیو,3.93,10000
1747,کتاب برنجک,3.93,10000
1748,کتاب پرواز با بال های خود,3.93,10000
1749,کتاب مثل یک درخت,3.93,10000
1750,کتاب یک بهار بیشتر,3.93,10000
1751,کتاب جلوه های اخلاق,3.93,10000
1752,کتاب فیل تنبل,3.93,10000
1753,کتاب قصه نوش آفرین گوهرتاج,3.93,10500
1754,کتاب مینوتوس مشاور نرون,3.93,11000
1755,ومبرلی نگران,3.93,11000
1756,کتاب این تنهایی لعنتی,3.93,11000
1757,کتاب سفرهای شگفت آور اولیس,3.93,11000
1758,کتاب فرهنگ و اقتصاد,3.93,11000
1759,کتاب دستگاه گوارش دام و طیور,3.93,11200
1760,کتاب وقتی هیتلر خرگوش صورتی مرا ربود,3.93,11500
1761,کتاب یکی درباره ی دیگری,3.93,12000
1762,کتاب چه کسی آب آبگیر را تمام کرد؟,3.93,12000
1763,کتاب هشت پای عصبانی,3.93,12000
1764,کتاب ایمان و آزادی,3.93,12000
1765,کتاب اصول تمرینات شنا,3.93,12000
1766,کتاب دعای کمیل,3.93,12000
1767,کتاب شکاف لایه ی ازون,3.93,12000
1768,کتاب فاطمه فاطمه,3.93,12000
1769,کتاب طائر قدس,3.93,13000
1770,دیدار غرب و شرق در هجرت گوته,3.93,13000
1771,هنری پنجم,3.93,13000
1772,کتاب اسم من نیلی,3.93,13000
1773,کتاب تصویرسازی,3.93,13500
1774,کتاب کلیدر در اسناد و واقعیات,3.93,14000
1775,کتاب اسپینوزای من,3.93,14000
1776,کتاب راهنمای ازدواج موفق,3.93,14000
1777,کتاب اشعار آئینی حبیب,3.93,14000
1778,کتاب مدیریت دانش,3.93,14000
1779,کتاب عکاسی و سینما,3.93,14800
1780,کتاب آیا نمک خدا را خورده ای؟,3.93,14900
1781,کتاب یک عمر دوستی,3.93,15000
1782,کتاب حضور خلوت انس,3.93,15000
1783,کتاب فرا روایت در ارباب حلقه ها,3.93,15000
1784,کتاب عیسای ناصری,3.93,15000
1785,کتاب مبانی و مفاهیم در فیلم نامه نویسی,3.93,15000
1786,کتاب درباره عرفان مسیحی,3.93,15000
1787,کتاب سازشناسی,3.93,15000
1788,کتاب لایه های پنهان در ادب معاصر ایران,3.93,15000
1789,کتاب وضعیت فلسفه در جهان,3.93,15000
1790,کتاب راهنمای هنر باروک,3.93,15000
1791,کتاب اندوه سفید,3.93,15000
1792,همه به هم کمک کنیم,3.93,15000
1793,هملت,3.93,15000
1794,کتاب حمل اولی و شایع,3.93,15000
1795,کتاب من از همه کوچکترم,3.93,15000
1796,کتاب 45 شعر از دیوان شمس تبریزی,3.93,15000
1797,کتاب حلقه های گمشده در روابط زناشویی و خانوادگی _ 1,3.93,15000
1798,کتاب سه بچه گربه,3.93,15000
1799,کتاب عشق یا سرزمین,3.93,15000
1800,کتاب چوپی خیلی شکمو است,3.93,15000
1801,کتاب رنگ آمیزی - رنگ ها,3.93,15000
1802,کتاب شکوفه ای برای سیب شدن تقلا می کند,3.93,15000
1803,کتاب احکام بانوان,3.93,16000
1804,کتاب لیفتینگ صورت,3.93,16000
1805,کتاب زبان منشوری ست,3.93,16000
1806,راسته کنسروسازی,3.93,16000
