,title,rating,price
2696,کتاب از چه رنگی به تن؟,3.89,16000
2697,کتاب لوگو پوستر,3.89,16500
2698,کتاب بیونیک,3.89,16500
2699,کتاب سیاست عشق میان هنر و فلسفه,3.89,17000
2700,کتاب من می توانم از شکل ها بگویم,3.89,17000
2701,کتاب یادگیری در فضای آزاد در سنین اولیه,3.89,17000
2702,کتاب پیروزی بر خشم,3.89,18000
2703,کتاب زیبای خفته,3.89,18000
2704,کتاب کلاغ آبی,3.89,18000
2705,کتاب کاکتوس ها همدیگر را دوست دارند,3.89,18000
2706,کتاب تو مخاطب همه ی انگشتان اشاره ای,3.89,18000
2707,کتاب قصه ی پلنگ سفید,3.89,18000
2708,کتاب غیر از خدا هیچ کس نبود,3.89,18000
2709,کتاب آشنایی با ابن سینا,3.89,18000
2710,کتاب گفتارهایی درباره علوم قرآن و حدیث,3.89,18000
2711,کتاب به سوی پسامدرن,3.89,18500
2712,کتاب اصول و فنون اندازه گیری هسته ای,3.89,18500
2713,کتاب مفاهیم کلیدی در علم سیاست,3.89,19000
2714,کتاب مغالطات آماری,3.89,19000
2715,کتاب پیکان زرد,3.89,19000
2716,کتاب ظرفیت های فراروی جهان اسلام,3.89,19200
2717,کتاب خال کوبی,3.89,19500
2718,کتاب راز آن اتاق,3.89,19500
2719,کتاب نگاه واقعی,3.89,19900
2720,کتاب بهارستان معانی,3.89,20000
2721,کتاب دانش خانواده و جمعیت,3.89,20000
2722,کتاب افسانه های روسی,3.89,20000
2723,کتاب مگنا کارتا,3.89,20000
2724,کتاب گربه دم بریده,3.89,20000
2725,کتاب نیرنگ های اسکاپن,3.89,20000
2726,کتاب پلی به سوی جاودانگی,3.89,20000
2727,کتاب بوی بسم الله,3.89,20000
2728,کتاب قصه های تصویری از پروین اعتصامی 7,3.89,20000
2729,کتاب مادر توی ‎قاب ‎عکس,3.89,20000
2730,کتاب دسیسه,3.89,20000
2731,کتاب قی چی,3.89,20000
2732,کتاب مرد همراه,3.89,20000
2733,کتاب محیط زیست,3.89,20000
2734,کتاب مامان ببر نبود,3.89,20000
2735,کتاب آی زنگوله آی زنگوله,3.89,20000
2736,کتاب مشاهیر وقف کتاب در ایران (7),3.89,20000
2737,کتاب لونه ی کی رو شاخ هاست؟ (پرندگان),3.89,20000
2738,کتاب خونه ی کی تو جنگله؟ (حیوانات جنگل),3.89,20000
2739,کتاب مبانی تحلیل تنش دیرین,3.89,21000
2740,کتاب حشره پژوهی,3.89,21000
2741,کتاب قصبه,3.89,21500
2742,کتاب برنامه ریزی آموزش ضمن خدمت کارکنان,3.89,22000
2743,کتاب کریستوا در قابی دیگر,3.89,22000
2744,کتاب دو قلوها,3.89,22000
2745,کتاب گذشته ی ابر,3.89,23000
2746,کتاب دکمه ی به درد نخور,3.89,23000
2747,کتاب مجموعه اشعار ویلفرد آوون,3.89,23000
2748,نینجای عصبانی,3.89,23000
2749,کتاب تانگرام های پیشرفته:خلاقیت و هوش فضایی,3.89,23000
2750,کتاب جنون آرامش بر نقطه فراموشی,3.89,23000
2751,بچه های آینه,3.89,23500
2752,کسب و کار بازاریابی شبکه ای خود را متحول کنید,3.89,24000
2753,کتاب مهمیرا,3.89,24000
2754,کتاب اصول مهندسی فشار قوی الکتریکی,3.89,24000
2755,کتاب نینا و نیم 2,3.89,24000
2756,کتاب مثل سه تا کبوتر,3.89,24000
2757,کتاب مرا به مریخ ببر,3.89,24000
2758,ابریشم,3.89,25000
2759,کتاب قصه زندگی من,3.89,25000
2760,کتاب شناخت وسایل ارتباط جمعی,3.89,25000
2761,کتاب کهن الگو های سینمای ایران,3.89,25000
2762,کتاب Just Like Mine,3.89,25000
2763,مردانی در آفتاب,3.89,25000
2764,کتاب اینگونه باشیم,3.89,25000
2765,از رنجی که می بریم,3.88,800
2766,کتاب از کلمه تا کبوتر,3.88,900
2767,کتاب فرزانگی در آیینه زمان,3.88,1000
2768,کتاب مشهد در بامداد نهضت امام خمینی (ره),3.88,1100
2769,کتاب آندره مالرو,3.88,1500
2770,کتاب راهنمای میان فرهنگی اجرا برای بازیگر,3.88,2050
2771,کتاب آشنایی با ده تفسیر قرآن کریم,3.88,2200
2772,کتاب قورباغه ها امتحان تافل دارند,3.88,3000
2773,کتاب افسانه های جن و پری,3.88,3300
2774,کتاب کجا می برند درختان مرده را,3.88,3500
2775,کتاب حادثه چهارم,3.88,3500
2776,کتاب مجنون رفیقی هروی,3.88,4000
2777,کتاب آشنایی ‏با تاریخ ‏معماری,3.88,4000
2778,کتاب مبانی ریزدیرینه شناسی,3.88,4000
2779,کتاب یاد بگیریم چگونه بر خود مسلط شویم,3.88,4000
2780,کتاب سکوت کاه گلی,3.88,4200
2781,کتاب ماجرای خونزاد,3.88,4500
2782,کتاب راز دل لوکا,3.88,4500
2783,کتاب بهادر,3.88,5000
2784,کتاب سقراط زخمی,3.88,5000
2785,کتاب پیش از طلوع خورشید,3.88,5000
2786,کتاب زخم هزار ترانه,3.88,5000
2787,کتاب خاطرات سری آدرین مول,3.88,5000
2788,موزه الفبا (3),3.88,5000
2789,کتاب صد نکته ی کلیدی برای زوج ها پس از جدایی,3.88,5000
2790,کتاب امام رضا (ع),3.88,5000
2791,کتاب لیلی و درخت انجیر,3.88,5000
2792,کتاب 60 روش کاربردی برای بهبود زندگی,3.88,5000
2793,کتاب امواج سرخ,3.88,5500
2794,کتاب ماجرای چراغ قرمز,3.88,5500
2795,کتاب حالا چه کار کنم,3.88,6000
2796,کتاب راز جنگل مهربان,3.88,6000
2797,کتاب چگونه مشکلات فیلمنامه مان را حل کنیم,3.88,6000
2798,کتاب قربانیان وظیفه,3.88,6000
2799,کتاب دختران سرهنگ مرحوم,3.88,6000
2800,کتاب به زنی در حوالی تهران,3.88,6000
2801,بپر بالا مگسک,3.88,6500
2802,کتاب زندگینامه مهاتما گاندی,3.88,6500
2803,حل مبانی ماشین های الکتریکی,3.88,6500
2804,کتاب متون تخصصی روان شناسی به زبان انگلیسی,3.88,6900
2805,کتاب من همان گونه خواهم مرد که زیسته ام,3.88,7000
2806,کتاب شهر گمشده ی گونزولانگا,3.88,7000
2807,کتاب داستان های زنجیره ای,3.88,7000
2808,کتاب میموزاهای الجزایر,3.88,7000
2809,کتاب صفات الله تعالی,3.88,7000
2810,کتاب دنیایی گریخته به من,3.88,7000
2811,شام خداحافظی,3.88,7000
2812,کتاب گردونه همستر,3.88,7000
2813,کتاب دسیه از عهده ی همه ی کارها برمی آید,3.88,7200
2814,کتاب زمین و ارباب و دهقان,3.88,7500
2815,کتاب مردی به نام دیوید,3.88,7500
2816,کتاب توپ تاپ تیپامبی,3.88,7500
2817,2 قلوهای حیرت انگیز,3.88,7500
2818,کتاب دست مایه ها,3.88,7500
2819,کمدی های کیهانی,3.88,7500
2820,کتاب هیچ وقت خوابیده بودم مگر مرگ,3.88,7500
2821,کتاب دم گربه ها را بکش,3.88,8000
2822,کتاب اسب ها، آموزش گام به گام طراحی,3.88,8000
2823,کتاب مستخدم ماشینی و درد خفیف,3.88,8000
2824,کتاب ناگفته هایی از سفر درمانی آیت الله سیستانی,3.88,8000
2825,کتاب شاید,3.88,8000
2826,کتاب حافظ خوانی,3.88,8000
2827,کتاب حاصل عمر,3.88,8500
2828,کتاب ایب لینکلن بزرگ می شود,3.88,8500
2829,کتاب دوچرخه سبز,3.88,8500
2830,هم آغوش روشنایی,3.88,9000
2831,کتاب راز دره نالان,3.88,9000
2832,کتاب پدیدارشناسی و سینما,3.88,9000
2833,کتاب آشنایی با وسایل ارتباط جمعی,3.88,9000
2834,کتاب بگذار من به رفتنت عادت نکنم,3.88,9000
2835,کتاب خانه دل,3.88,9000
2836,کتاب قواعد بازی,3.88,9500
2837,کتاب عشق و شباب و رندی,3.88,9500
2838,کتاب ماندنی,3.88,9500
2839,کتاب دیدار در حلب,3.88,9800
2840,کتاب سه هزار پرسش زیست شناسی و پاسخها,3.88,9800
2841,هارولد در سیرک,3.88,10000
2842,کتاب سمندر، ورای عشق,3.88,10000
2843,کتاب چرا خدا هرگز نمی میرد,3.88,10000
2844,کتاب یوسف و زلیخا,3.88,10000
2845,کتاب راندن در جاده زندگی,3.88,10000
2846,کتاب زندگی کیفی,3.88,10000
2847,کتاب یک شعر بی طاقت,3.88,10000
2848,کتاب ای مردان شجاع، ایران شما را از یاد نخواهد برد,3.88,10000
2849,کتاب صدایی از دیوار,3.88,10000
2850,کتاب ذبیح,3.88,10000
2851,کتاب به میچکا که روز و شب ها پشت پنجره ام بود,3.88,10000
2852,کتاب دو قلوها با پلیس آشنا می شوند,3.88,10000
2853,قصه های تصویری از منطق الطیر 6,3.88,10000
2854,کتاب فیل و گنجشک,3.88,10000
2855,کتاب همسایه ی ما,3.88,10000
2856,کتاب دوراهی,3.88,10000
2857,آفرین دختر گلم 4,3.88,10000
2858,آفرین دختر گلم 15,3.88,10000
2859,کتاب جنگ نرم و یکپارچگی اقتدار ملی,3.88,10000
2860,کتاب امام جعفر صادق (ع),3.88,10000
2861,کتاب مبانی روانشناختی تحکیم خانواده در غربت,3.88,11000
2862,کتاب تو ماهی و من آدم,3.88,11000
2863,کتاب شاه دسامبر کوچولو,3.88,11000
2864,کتاب اسم شوهر من تهران است,3.88,11500
2865,موفقیت در بازاریابی شبکه ای,3.88,11900
2866,کتاب تاریخ شفاهی مطبوعات ایران,3.88,12000
2867,کتاب آقای استون و شهسواران ملازم,3.88,12000
2868,عروس دریا 1,3.88,12000
2869,کتاب عاشقی با ژاکت سفید,3.88,12000
2870,کتاب مارپیچ سیاه,3.88,12000
2871,کتاب سیاره توکی ها,3.88,12000
2872,کتاب چرا دخترها اینقدر در ریاضی خوب هستند,3.88,12000
2873,کتاب شادمانه,3.88,12000
2874,کتاب راهنمای عملی نگارش طرح کسب و کار,3.88,12000
2875,کتاب تنهایی من زنی جوان است هنوز,3.88,12000
2876,کتاب ابراهیم (ع) در آتش,3.88,12000
2877,کتاب از تو برای تو,3.88,12500
2878,کتاب به خشونت در مدرسه پایان دهیم,3.88,12500
2879,کتاب کینز,3.88,12500
2880,کتاب دین جهانی شدن و فرهنگ سیاسی در جهان سوم,3.88,12500
2881,کتاب چگونه بیشترین سود را از سرمایه گذاری در املاک بدست آورید,3.88,13000
2882,کتاب حلقه های درهم,3.88,13000
2883,کتاب ساعت عشق,3.88,13000
2884,کتاب گفتمانی دیگر از توسعه در ایران,3.88,13500
2885,کتاب چگونه یک آتشفشان تبدیل به جزیره می شود؟,3.88,14000
2886,کتاب گلدان/ بهار و عروسک,3.88,14000
2887,کتاب چه شربت شیرینی,3.88,14000
2888,کتاب خانه ای مثل بهشت,3.88,14000
2889,کتاب مهربان ترین دوست,3.88,14000
2890,کتاب روزی که او خود اشکهای مرا پاک خواهد کرد,3.88,14000
2891,کتاب گفت و گوی یک روانشناس با دخترش,3.88,14000
2892,کتاب طبل زن ها,3.88,14000
2893,کتاب ناز و نیاز,3.88,14000
2894,کتاب خبر در قرن بیست و یکم,3.88,14000
2895,کتاب برجام,3.88,14000
2896,کتاب زیبارویان جهان همه همسایه تواند,3.88,14000
2897,کتاب سرزمین دهم,3.88,14500
2898,کتاب فوق سری,3.88,14500
2899,کتاب حجر الاسود,3.88,15000
2900,قاتلی به پاکی برف,3.88,15000
2901,کتاب سیاتیک,3.88,15000
2902,کتاب آموزش نحو متن محور 1,3.88,15000
2903,کتاب زره کرگدن به تن دارم,3.88,15000
2904,کتاب اصول اساسی علم اقتصاد,3.88,15000
2905,کتاب جغد پر حرف,3.88,15000
2906,کتاب بدون استرس زندگی کنید,3.88,15000
2907,کتاب شطح نو,3.88,15000
2908,کتاب کنترل وزن,3.88,15000
2909,من گدایی می کنم,3.88,15000
2910,کتاب آموزه های بزرگمهر حکیم,3.88,15000
2911,کتاب چیمو کوچولو,3.88,15000
2912,کتاب نی نی دارم قد یه دونه زیتون,3.88,15000
2913,کتاب تنش را برای زمان تفسیر می کند,3.88,15000
2914,کتاب هیولای برفی,3.88,15000
2915,کتاب پلک نزن,3.88,15000
2916,کتاب صندلی خاطرات,3.88,15000
2917,ماجرای باربد و دوستی با حمام,3.88,15000
2918,قصه های منظوم از 14 معصوم 3 : ماه و آن گردنبند,3.88,15000
2919,کتاب در مهد کودک,3.88,15000
2920,کتاب سبز سبز مثل قلب تو,3.88,15000
2921,کتاب سیاه نمایی یا جاذبه؟,3.88,15900
2922,کتاب راستی آخرین بار پدرت را کی دیدی؟,3.88,16000
2923,کتاب آشپزخانه,3.88,16000
2924,کتاب یاد عزیزان در برگ ریزان,3.88,16000
2925,مهمان ناخوانده,3.88,16000
2926,کتاب چهار دقیقه و همان چهار دقیقه,3.88,16000
2927,کتاب فلسفه اقتصاد,3.88,16000
2928,کتاب کلید ترفندهای دانلود,3.88,16000
2929,کتاب حقوق قراردادها در فقه امامیه,3.88,16700
2930,کتاب بویلرها و کوره ها,3.88,16800
2931,کتاب انقلاب مشروطه با رسم شکل!,3.88,17000
2932,کتاب آشنایی با روش های تبلیغی,3.88,17000
2933,کتاب مرگ به سراغ اسقف اعظم می آید,3.88,17000
2934,کتاب بچه های مسجد 3,3.88,17000
2935,کتاب شبت به خیر خداجون,3.88,17500
2936,کتاب فناوری اطلاعات در مقیاس جهانی,3.88,17900
2937,کتاب ادبیات در مخاطره,3.88,18000
2938,کتاب پویایی های سیستم,3.88,18000
2939,کتاب راهنمای جامع نسخه نویسی,3.88,18000
2940,کتاب با خیال ها و بی خیال ها,3.88,18000
2941,کتاب توپ پشمی جادویی,3.88,18000
2942,کتاب قصه های وینی پو18,3.88,18000
2943,کتاب گوشواره های فلزی,3.88,18000
2944,کتاب خواب بره,3.88,18000
2945,کتاب دادگاه نویسنده,3.88,18000
2946,کتاب فنجون ویکتوریایی,3.88,18000
2947,کتاب 100 حقیقت درباره ی میمون ها,3.88,19000
2948,امشب چه کسی من را می خواباند؟,3.88,20000
2949,کتاب من گذشته امضا,3.88,20000
2950,کتاب میثم تمار,3.88,20000
2951,شکوفایی توانایی های نهفته,3.88,20000
2952,کتاب چشم شاهد,3.88,20000
2953,کتاب مدیریت رفتار سازمانی پیشرفته,3.88,20000
2954,کتاب گومپ گومپ,3.88,20000
2955,کتاب زندگی بر روی میسی سیپی,3.88,20000
2956,کتاب آب زیرزمینی و نشت,3.88,20000
2957,دیوان کامل اشعار فروغ فرخزاد,3.88,20000
2958,کتاب نشانگر همه چیزها,3.88,20000
2959,کتاب دوستت دارم امضای من است,3.88,20000
2960,24 ساعت از زندگی یک زن,3.88,20000
2961,بندگان مشتاق سرمایه,3.88,20000
2962,کتاب شرح بت پرستی ها,3.88,20000
2963,کتاب از تبار حبیب,3.88,20000
2964,کتاب یک روز خوشحال,3.88,20000
2965,کتاب مردی در یک موقعیت,3.88,20000
2966,کتاب سنجابک خیلی گرسنه,3.88,20000
2967,کتاب مثل فرشته ها,3.88,20000
2968,کتاب آموزش HTML برای نوجوانان,3.88,20000
2969,هفت خوان اسفندیار 4,3.88,20000
2970,کتاب Shaparak = شاپرک بنفش,3.88,20000
2971,کتاب جلجتا,3.88,21000
2972,کتاب الفبای بحران اقتصادی,3.88,21000
2973,کتاب کفترکش,3.88,21000
2974,کتاب تاریخ تحولات جمهوری اسلامی ایران,3.88,21000
2975,کادوززززز,3.88,22000
2976,کتاب توتمیسم,3.88,22000
2977,کتاب میوه ها,3.88,22000
2978,کتاب بیب، بیب، برو بخواب!,3.88,22000
2979,کتاب زمین مادران,3.88,22000
2980,کتاب آخر رفاقت,3.88,22000
2981,کتاب پرسش های مهدوی,3.88,22000
2982,کتاب زیر انگشت های تشریح,3.88,22000
2983,کتاب کاربرد 3DS MAX در معماری,3.88,22000
2984,کتاب دل آرام,3.88,23000
2985,نینجای امیدوار,3.88,23000
2986,کتاب مقدمه ای بر نظریه اقتصاد سیاسی اسلامی,3.88,23000
2987,کتاب بعد دیگر نمی توان خوابید,3.88,24000
2988,کتاب دل و دشنه,3.88,24000
2989,کتاب قصه سینماجات عهد بوق,3.88,24000
2990,کتاب قصه های من و مامان (جلد 1),3.88,24000
2991,کتاب زبان شناسی و آموزش زبان فارسی,3.88,25000
2992,کتاب یک مشت بغض کال,3.88,25000
2993,کتاب مکانیک کوانتومی,3.88,25000
2994,کتاب توپک خوش بینی,3.88,25000
2995,کتاب فلسفه نوین بریتانیا,3.88,25000
2996,کتاب رفتار مصرف کننده,3.88,25000
2997,کتاب زندگی ماریان,3.88,25000
2998,مدیریت اسلامی,3.87,1800
2999,کتاب اما اینجا هنوز برف می آد,3.87,2000
3000,کتاب پسر و پروانه,3.87,2500
3001,کتاب اتل متل دو قصه,3.87,2500
3002,پدرم متشکرم,3.87,2800
3003,کتاب پیوندهای ناپیدا,3.87,2800
3004,کتاب مهمونی رنگین کمونی,3.87,2800
3005,کتاب نی نی خرسه,3.87,3000
3006,کتاب گیاهان در قرآن,3.87,3100
3007,کتاب فرشته ای ازآسمون,3.87,3500
3008,کتاب چهره ای جدید در 21 روز,3.87,3700
3009,کتاب پیکاسو در آب های خلیج فارس,3.87,3800
3010,کتاب بازدارندگی,3.87,4000
3011,کتاب نظام اجتماعی مغول,3.87,4000
3012,کتاب برگزیده شعرهای عطار نیشابوری,3.87,4200
3013,کتاب نام مان در هوا سرگردان است,3.87,4500
3014,کتاب شعرهایی برای کودکان,3.87,4800
3015,کتاب آیت الله طالقانی و تفسیر پرتوی از قرآن,3.87,4800
3016,کتاب آمایش سرزمین و برنامه ریزی محیطی,3.87,4800
3017,کتاب بایدها و نبایدها در تربیت کودکان و نوجوانان,3.87,4900
3018,کتاب رویاهای زمستانی,3.87,5000
3019,کتاب خون خدا,3.87,5000
3020,کتاب حسنی و سه بزغاله,3.87,5000
3021,کتاب روباه پلید کلاغ سفید,3.87,5000
3022,کتاب جملات قصار و اندیشه های دکتر علی شریعتی,3.87,5000
3023,کتاب در یک خانواده ایرانی,3.87,5000
3024,کتاب نمی توان کلاغ ماند,3.87,5000
3025,کتاب راهنمای کاربرد ایمن لیزرها در پزشکی,3.87,5000
3026,کتاب مشاهیر کتابشناسی معاصر ایران (20),3.87,5000
3027,کتاب مشاهیر نشر کتاب ایران (6),3.87,5000
3028,کتاب فریادهای دلتنگی در سکوت نیمه شب,3.87,5500
3029,کتاب تئوری مرمت,3.87,6000
3030,دیوید کاپرفیلد,3.87,6000
3031,کتاب دختر عاشق هخامنشی,3.87,6000
3032,کتاب مانی و تعلیمات او,3.87,6200
3033,کتاب داستان بهرام چوبینه,3.87,6500
3034,کتاب خواندن متون و واژگان دانشگاهی,3.87,6500
3035,کتاب روش های نانوپوشانی اجزای تشکیل دهنده موادغذایی,3.87,6700
3036,کتاب برهنه با زمین,3.87,7000
3037,کتاب بازی ریپلی,3.87,7000
3038,کتاب بچه ها بیایید نمایش 5,3.87,7000
3039,کتاب سکوت,3.87,7000
3040,کتاب دارکوب تا کی به درخت خواهد کوبید؟,3.87,7000
3041,کتاب گفتمان مناظره ای,3.87,7000
3042,کتاب من شاد بودن را می آموزم,3.87,7000
3043,کتاب رقص کوزه,3.87,7000
3044,کتاب از من بعید,3.87,7200
3045,کتاب خاکستر رز,3.87,7500
3046,کتاب این ساعت شنی که به خواب رفته است…,3.87,7500
3047,کتاب آتش نشان ها و داستان هایشان 5,3.87,7500
3048,قصه هایی از امام جواد (ع) 4,3.87,7500
3049,کتاب زنان در داستان,3.87,8000
3050,کتاب فناوری و اصول زیست شناسی بذر,3.87,8000
3051,کتاب با هم زندگی کنیم,3.87,8000
3052,رویا,3.87,8000
3053,کتاب توماس آکوئینی,3.87,8000
3054,کتاب استکان کمر باریک مادری,3.87,8000
3055,کتاب شنیدم که دیگر نمی آیی,3.87,8000
3056,کتاب اسم تو یعنی بهار,3.87,8000
3057,کتاب دایناسورها,3.87,8500
3058,کتاب اندیشه هایی در حقوق اسلامی,3.87,8500
3059,کتاب شرح دعای سحر,3.87,8500
3060,کتاب جوجه تیغی و درخت سیب,3.87,8500
3061,کتاب فیل ها,3.87,9000
3062,کتاب کودک ات را درک کن,3.87,9000
3063,کتاب کمیته مشترک ضد خرابکاری,3.87,9000
3064,کتاب جنوب مرز،غرب خورشید,3.87,9500
3065,کتاب ریشه شناسی,3.87,9500
3066,کتاب هفت خوان پیاز نرگس,3.87,9500
3067,کتاب سوفی و حلزون,3.87,10000
3068,کتاب قهرمانان بادپا,3.87,10000
3069,کتاب نیکسی و شیطنت های تابستانی,3.87,10000
3070,کتاب وایولت آب بازی می کند,3.87,10000
3071,کتاب تاریخ کادوس ها,3.87,10000
3072,مدرسه زندگی 2,3.87,10000
3073,کتاب گردان چهار نفره,3.87,10000
3074,کتاب روزی که جوحا گم نشد,3.87,10000
3075,کتاب روزی که جوحا انگشترش را گم کرد,3.87,10000
3076,کتاب آقا عنکبوت بندباز,3.87,10000
3077,کتاب ژاژنامه,3.87,10000
3078,کتاب کتابی برای روزهای بد,3.87,10000
3079,کتاب فانوس بندری,3.87,10000
3080,کتاب انقلاب اسلامی ایران و بیداری اسلامی,3.87,10000
3081,کتاب شیرین و مجنونی که بابا می گفت,3.87,10000
3082,کتاب افسانه چهارشنبه سوری,3.87,10000
3083,کتاب اکولوژی,3.87,10000
3084,کتاب هایلی پری باران,3.87,10800
3085,کتاب شب های کوش آداسی,3.87,11000
3086,کتاب هر صبح می میریم,3.87,11000
3087,کتاب هر زندگی یه قصه است,3.87,11000
3088,کتاب چگونه نقاط ضعفم را به نقاط قوت تبدیل کنم,3.87,11900
3089,کتاب گنج شطرنج 3,3.87,12000
3090,هیاهوی بسیار برای هیچ,3.87,12000
3091,کتاب ارسطو,3.87,12000
3092,کتاب به تو که هنوز زاییده نشده ای,3.87,12000
3093,کتاب موسی (ع) پیروز می شود,3.87,12000
3094,کتاب دانی و عید نوروز,3.87,12000
3095,کتاب به رنگ حرم,3.87,12000
3096,کتاب خدا چه مهربان است,3.87,12000
3097,کتاب چگونه خانه ای ایمن در برابر امواج الکترو مغناطیسی داشته باشیم؟,3.87,12100
3098,کتاب رسانه و فناوری,3.87,12500
3099,پدران توانا دختران قوی,3.87,12500
3100,کتاب صادقیه در بیات اصفهان,3.87,12500
3101,کتاب منظومه سلامان و ابسال,3.87,12500
3102,کتاب فرصتی برای شیخ,3.87,13000
3103,مصائب کار,3.87,13000
3104,کتاب زرافه و شغال درونمان را بشناسیم,3.87,13900
3105,ماجراهای قورباغه و وزغ (کلاه بزرگ و کلاه کوچک),3.87,14000
3106,کتاب اشک و لبخند,3.87,14000
3107,کتاب جامعه شناسی ادبیات فارسی,3.87,14000
3108,کتاب عناصر,3.87,14000
3109,زندگانی بتهوون,3.87,14500
3110,کتاب روش شناسی علم اقتصاد اسلامی,3.87,14800
3111,نخستین عشق,3.87,15000
3112,کتاب مقالاتی درباره زیباشناسی هنر,3.87,15000
3113,کتاب غزل شیرین عشق,3.87,15000
3114,کتاب زندانی مردمان مورچه ای,3.87,15000
3115,کتاب پرنده اگر برگردیم,3.87,15000
3116,کتاب تو مگر تا کدام نقطه؟,3.87,15000
3117,کتاب ادعیه و اعمال ماه مبارک رمضان,3.87,15000
3118,کتاب موش ها و آدم ها,3.87,15000
3119,کتاب هابز,3.87,15000
3120,کتاب دستور زبان فارسی,3.87,15000
3121,کتاب نقش 82,3.87,15000
3122,کتاب راهزنان,3.87,15000
3123,کتاب پسری که با رود آمد,3.87,15000
3124,کتاب با ادب بودن خوب است,3.87,15000
3125,کتاب مرتاضه ی عصر 2020,3.87,15000
3126,کتاب نیستدر جهان,3.87,15000
3127,کتاب عبور از رنج ها,3.87,15000
3128,کتاب انگار ساعت از سرت گذشته است!,3.87,15000
3129,کتاب تانی تولد می گیرد,3.87,15000
3130,کتاب نوئمی 10,3.87,15000
3131,کتاب طراحی لباس کودک,3.87,15000
3132,کتاب غول راشومون,3.87,15000
3133,کتاب فقط تنها نباشم,3.87,15000
3134,کتاب اگه من فیل بودم,3.87,15000
