,title,rating,price
0,کتاب پسر بچه ای که حوصله اش سررفته بود,5.0,7000
1,کتاب برای نشستن کنار تو,5.0,7500
2,کتاب سانتاماریا,5.0,9000
3,کتاب زندگی را به رقص آور!,5.0,10000
4,کتاب جشن های باستانی ایران,5.0,10000
5,کتاب انفاق,5.0,10000
6,کتاب دل نکته های معلم بازاریابی,5.0,15000
7,کتاب سه روایت جعلی,5.0,15000
8,کتاب فردوسی و شاهنامه او,5.0,16000
9,کتاب عبور از سوئز,5.0,16000
10,کتاب ماشو در مه,5.0,18000
11,کتاب گفتمان و حقیقت,4.71,20000
12,کتاب گورکن ها گریه هایشان را عمیق تر حفر میکنند,4.67,8000
13,کتاب هنر و مالتیتود,4.67,24000
14,کتاب تادئوش کانتور,4.6,15500
15,کتاب خیره به ابدیت,4.6,24000
16,کتاب غرش ماده شیر (جلد ۱),4.59,2200
17,کتاب رضاشاه,4.571429,10000
18,کتاب مانیفست یک فمینیست در پانزده پیشنهاد,4.56,25000
19,کتاب بنگر فرات خون است,4.51,21000
20,کتاب نامه ای به یک دوست قدیمی,4.5,4000
21,کتاب تو را معراجی بر نی,4.5,6000
22,سنگ شیطان,4.5,8000
23,کتاب پیمان خون,4.5,8500
24,شهر هاوکینز هالو,4.5,8500
25,کتاب نوشته های سیاسی,4.5,9500
26,کتاب تکاثر,4.5,10000
27,کتاب پسر,4.5,12000
28,کتاب نلسون ماندلا,4.5,14900
29,کتاب راز کانال کمیل,4.39,19000
30,هیولایی صدا می زند,4.37,11000
31,کالون و قیام کاستلیون,4.37,12900
32,کتاب میان سایه های خاکستری,4.36,10800
33,کتاب خویشاوندی با خورشید و باران,4.36,17000
34,کتاب به خاطر آقای تراپت,4.35,16000
35,کتاب لوراکس,4.35,19000
36,کتاب وای!چه جاها که خواهی رفت,4.35,19000
37,رفیق دن کامیلو,4.35,23800
38,کتاب چراغی زیر شیروانی,4.34,11000
39,کتاب روح امپراطور,4.34,19000
40,کتاب اپیکور,4.33,3000
41,کتاب آنتوان چخوف و شش داستان دیگر,4.33,12000
42,کتاب دریای خاکستری,4.33,12000
43,کتاب مجموعه قصه های حسن کچل,4.33,19500
44,کتاب سفرهای خطرناک من,4.33,20000
45,کتاب بالا افتادن,4.33,22000
46,کتاب در بوسه های تو به خواب خواهم رفت,4.32,11000
47,کتاب سربازان خدا,4.32,12000
48,از نوشتن,4.32,18500
49,کتاب ایوان واسیلویچ,4.32,20000
50,پیش به سوی قرن بیست و یک,4.31,10000
51,کتاب اسنیچ های با ستاره و اسنیچ های بی ستاره,4.31,22000
52,کتاب بازی اندر,4.3,11500
53,هنوز آلیس,4.3,12000
54,نیمه ی یک خورشید طلایی,4.29,11000
55,10 راز دستیابی به موفقیت و آرامش درون,4.29,18900
56,کتاب ماتا هاری,4.29,22000
57,ماهی ها پرواز می کنند!,4.29,22000
58,کتاب استونر,4.29,23000
59,کتاب به کبوتر اجازه نده اتوبوس براند,4.29,25000
60,کتاب بابامومین در دریا,4.28,9900
61,کتاب مجمع الجزایر رویا,4.28,18000
62,کتاب لحظه های بودن,4.27,5400
63,کتاب داستانهای کرونوپیوها و فاماها,4.27,13000
64,کتاب اخلاص,4.26,10000
65,کتاب استانیسلاوسکی سر تمرین تئاتر,4.26,22000
66,کتاب درمانگر,4.25,6000
67,بلندی های ماچوپیچو,4.25,6500
68,کتاب قصر شیشه ای,4.25,9000
69,کتاب سرگذشت عزیزبیک,4.25,12000
70,کتاب دانه و پیمانه,4.25,13000
71,کتاب هزار و چند شب لیالی,4.25,13000
72,کتاب این جا,4.25,14000
73,کتاب خانه ماتریونا,4.25,20000
74,کتاب دشت های سوزان,4.24,23000
75,کتاب خاطره ای از کریسمس,4.24,25000
76,کتاب نه من و آمد و رفت,4.23,3000
77,کتاب داستان های کوتاهی از قهرمانی ها,4.23,10000
78,کتاب همه افتادگان,4.23,14000
79,خروس زری پیرهن پری,4.22,10000
80,کتاب مجازات,4.22,15000
81,دنبال قلبت برو,4.22,18000
82,کتاب خرسی به نام پدینگتن,4.22,22000
83,کتاب آرامش برون،آتش درون,4.21,9000
84,کتاب روی پله های کنسرواتور,4.21,10000
85,دگرگونی,4.21,11000
86,کتاب رابرت کندی از غرق شدن نجات یافت,4.21,12000
87,کتاب کلاغ و اشعار دیگر,4.21,13000
88,کتاب آشپز خانه خانم گیلاس,4.21,15000
89,کتاب پی جو,4.21,20000
90,کتاب به دوستان آن سوی مرزها,4.2,6000
91,کتاب آتش کم فروغ,4.2,8500
92,کتاب فروخته شده,4.2,14900
93,کتاب انگار آن جا نیستم,4.2,16000
94,کتاب لطفا رنج نکشید,4.2,20000
95,کتاب فرهنگ و زندگی روزمره,4.2,21900
96,کتاب آوازهای کولی,4.19,5000
97,کتاب دشت سوزان,4.19,21000
98,کتاب بادبزن کاغذی,4.18,20000
99,کتاب راهنما,4.17,4400
100,کتاب هرگز نیفت,4.17,15000
101,کتاب پادشاهی کهن جلد اول سابریل,4.17,18000
102,بیندیشید و ثروتمند شوید,4.17,19000
103,کتاب هورتون جوجه از تخم در می آورد,4.16,6000
104,کتاب سروده های جیاکومو لئوپاردی,4.16,10000
105,کتاب تفنگت را زمین بگذار,4.16,12000
106,کتاب تولد یک قهرمان,4.16,25000
107,کتاب دیالکتیک تنهایی,4.15,10000
108,کتاب عشق جایش تنگ است,4.15,13000
109,کتاب بقای سرمایه داری,4.15,13000
110,کتاب جاده موفقیت,4.15,14900
111,کتاب راهی طولانی که رفتم,4.15,20000
112,کتاب گمشده,4.15,23000
113,کتاب سینماگران بزرگ 11,4.15,25000
114,اوهام,4.14,7500
115,کتاب و آنگاه خدا عشق را آفرید,4.14,9500
116,کتاب در هوای رقیق,4.14,14000
117,کتاب شش گشت و گذار در جنگل های روایت,4.14,14000
118,کتاب بیگانه ای در دهکده,4.14,17500
119,کتاب لژیون,4.14,19000
120,کتاب خاطرات یک دروغگو,4.14,22500
121,کتاب نکروپلیس,4.14,23000
122,بازگشت,4.14,25000
123,کتاب باغ فراموش شده,4.13,25000
124,اختر فیزیک برای افراد بی قرار,4.13,25000
125,کتاب هاروی,4.12,7500
126,کتاب تیرهای سقف را بالا بگذارید,4.12,8500
127,پسرکی با پیژامه راه راه,4.12,13000
128,کتاب آنچه با خود حمل می کردند,4.12,14000
129,کتاب ضربه های شفابخش,4.12,17900
130,کتاب انرژی و عدالت,4.12,18000
131,کتاب فوکو,4.12,20000
132,منظومه سرزمین بی حاصل,4.11,9000
133,کتاب قاتل بدون مواجب,4.11,9500
134,کتاب علم علیه شانس,4.11,15500
135,کتاب کاغذ دیواری زرد,4.11,19000
136,کتاب فتیشیسم در موسیقی و واپس روی شنیدن,4.11,20000
137,کتاب لوته و همتایش,4.11,20000
138,کتاب آخرین غروب های زمین,4.11,22000
139,کتاب کودکی به نام «این»,4.1,3000
140,درنده ی باسکرویل,4.1,5000
141,کتاب رویای جورج ار,4.1,14000
142,کتاب آوازهای کوچکی برای ماه,4.1,16000
143,کتاب چمدان پدرم,4.1,17000
144,کتاب روایت نابودی ناب,4.1,18000
145,کتاب زندگی من در گذر زمان,4.1,22000
146,کتاب بن بست نویسنده,4.1,24000
147,کتاب سقوط مردی از آسمان به چه معناست؟,4.1,24000
148,کتاب سوپ جوجه برای روح مادر,4.09,1000
149,پسر سرگردان,4.09,5000
150,کتاب اندیشه یونانی، فرهنگ اسلامی,4.09,22000
151,برای یک روز بیشتر,4.09,25000
152,گل هایی به یاد آلجرنون,4.08,4700
153,کتاب لوتای آتش پاره 1,4.08,14000
154,کتاب آتش سوزان,4.08,15000
155,کتاب پیتر پن,4.08,15000
156,تبهکاری و جرم,4.08,19500
157,رنجبران دریا,4.08,20000
158,کتاب پنج حکایت,4.08,25000
159,کتاب سوپ ماهی,4.07,8000
160,کتاب تورگنیف خوانی,4.07,8000
161,کتاب چشم اندازهای اسطوره,4.07,9000
162,عشق با زمستان می آید,4.07,17000
163,کتاب رنگ آب,4.07,20000
164,کتاب چرا روانکاوی,4.07,24000
165,۲۱ رمز موفقیت میلیونرهای خودساخته,4.06,6500
166,کتاب مسجد پروانه,4.06,12000
167,کتاب چنبره افعی ها,4.06,20000
168,کتاب راستی چرا؟,4.06,21000
169,کتاب فلسفه سیاسی استوارت میل,4.06,25000
170,کتاب همه کاری که باید بکنی کشتن است,4.06,25000
171,کتاب نقاب آپولون,4.05,9800
172,کتاب بچه ها در جشن تولد,4.05,11000
173,کتاب یکشنبه بعد از روز مادر,4.05,12000
174,کتاب یک سیخ گلابی جانانه,4.05,12000
175,کتاب کتاب اشتیاق,4.05,15000
176,کتاب هنری زلزله و ماشین زمان,4.05,16000
177,کتاب سفر پرسش,4.05,17000
178,کتاب دست نامرئی,4.05,20000
179,کتاب هنری زلزله و پرستار لولو خورخوره,4.05,20000
180,کتاب خوشبختانه شیر,4.05,24000
181,حالا وقت دویدن است,4.05,25000
182,کورالاین,4.04,6500
183,همه ترس هایم,4.04,9500
184,کتاب آقای نویسنده و همکارش,4.04,11000
185,وصایای تحریف شده,4.04,15000
186,کتاب قبیله خرس غار,4.04,20000
187,کتاب طلوع تاریکی,4.04,23000
188,کتاب ظلمت آشکار,4.04,25000
189,درس و آوازخوان طاس,4.04,25000
190,تعطیلات شکلاتی,4.03,7000
191,کتاب ژنرال جنوبی اهل بیگ سور,4.03,10000
192,مراسم تدفین,4.03,25000
193,کتاب جان عزیزم,4.02,8000
194,طرح باشکوه,4.02,10500
195,اثبات,4.02,12000
196,کتاب آن سوی آینه,4.02,16000
197,کتاب هنری زلزله و خانه ی اشباح,4.02,16000
198,کتاب در قند هندوانه,4.02,16500
199,کتاب غم های کوچک,4.02,19000
200,منطق اکتشاف علمی,4.02,20000
201,کتاب این کتاب برای پسران خطرناک است,4.02,22000
202,راه آهن زیرزمینی,4.02,25000
203,ما یک عمر قلعه نشین بوده ایم,4.02,25000
204,کتاب پاره یادداشت ها,4.01,5200
205,روزنکرانتز و گیلدنسترن مرده اند,4.01,14000
206,کتاب نگران نباش داستایوفسکی,4.01,15000
207,کتاب بمب، روی خاله مامانی,4.01,18500
208,آب های شمال,4.01,20000
209,به پیوست دوستت دارم,4.01,20000
210,کتاب تجربه ی شهری,4.01,20000
211,کتاب مسئله ی تقصیر,4.01,25000
212,کتاب ساحل جادویی,4.0,1500
213,کتاب مرجع شناسی عمومی لاتین,4.0,1600
214,کتاب ملا فتح الله کاشانی و تفسیر منهج الصادقین,4.0,2200
215,کتاب اطلاعات استراتژیک و کشورداری,4.0,2400
216,کتاب شب پر ستاره,4.0,2500
217,کتاب شیشه های شکسته,4.0,2500
218,کتاب نوآوری بستر پیروزی,4.0,2800
219,کتاب تریبون,4.0,3000
220,کتاب عشق بدون شک,4.0,3200
221,کتاب مرد جوان بی باک روی طناب بندبازی و داستان های دیگر,4.0,3900
222,کتاب محفل شاعران آیینی,4.0,4000
223,کتاب ماچ را بگذار برای بعد,4.0,4000
224,کتاب قصیده ی مجروح آب,4.0,5000
225,کتاب بهترین هدیه,4.0,5000
226,کتاب کارد و طناب,4.0,5000
227,کتاب هفت برادر,4.0,5000
228,کتاب بایسته های زناشویی,4.0,5500
229,کتاب اره ماهی در آهنگری,4.0,5500
230,کتاب انتقام بانو اژدها,4.0,5500
231,کتاب معمای شکسپیر,4.0,6000
232,کتاب آلخاندرو و ماهیگیران تانکای,4.0,6000
233,کتاب زندگی شادمانه با آگاهی برتر,4.0,6500
234,کتاب از کلید آبی رنگ گاهی صدای دریا را می شنید,4.0,6500
235,کتاب این ردپای عجیب,4.0,6500
236,کتاب امپراطوری قافیه ها,4.0,6500
237,کتاب این راز مال من است…!,4.0,7000
238,کتاب پایان شب سیه,4.0,7000
239,کتاب قدم بخیر مادر بزرگ من بود,4.0,7000
240,کتاب مادربزرگ من گوریل است,4.0,7000
241,کتاب دیدار با ذات الریه,4.0,7000
242,کتاب تلخ انگبین,4.0,7000
243,کتاب مدیریت دانش در سازمان های پروژه محور,4.0,7350
244,کتاب آفرینش خدایان,4.0,7500
245,کتاب مغز حرام,4.0,7500
246,قصه هایی از امام جواد (ع) 6,4.0,7500
247,کتاب ماه پیشانی,4.0,8500
248,کتاب شاعر صبح,4.0,8500
249,کتاب روزهای ناکوک,4.0,8500
250,کتاب برادران رایت,4.0,9000
251,کتاب نیگی و رویاهای رنگی,4.0,9000
252,کتاب مناجات شعبانیه,4.0,9500
253,کتاب بانو و مرد مرده,4.0,10000
254,کتاب آپارتمان پائولین,4.0,10000
255,کتاب سوفی شش ساله,4.0,10000
256,کتاب مطالعه ژنوم و پروتئوم گیاه,4.0,10000
257,کتاب بریم جشن تولد,4.0,10000
258,کتاب اجسام,4.0,10000
259,کتاب خانه ای از جنس آب,4.0,10000
260,کتاب کودکی,4.0,10000
261,کتاب من یک نه_دیگران هستم,4.0,10000
262,کتاب حماسه گیلگمش,4.0,11000
263,کتاب هتل عروس,4.0,11000
264,کتاب خروج مرد بیوه,4.0,11000
265,مقدمه ای بر آرایش و پیرایش کودکان,4.0,11000
266,کتاب مهارت مقابله با مشکلات سالمندی,4.0,11000
267,کتاب آسید کاظم و تیغ و ترنا,4.0,11500
268,کتاب مروارید,4.0,12000
269,کتاب کونستانتسه موتسارت,4.0,12000
270,کتاب مهدی شناسی,4.0,12000
271,کتاب هر قلبی که می تپد عاشق نیست شاید فقط پمپ خون باشد,4.0,12000
272,کتاب راهنمای بهداشت و تغذیه دایناسورها,4.0,12000
273,کتاب امپراتور سیب زمینی چهارم,4.0,12800
274,کتاب حذف افکار و احساسات سمی,4.0,12900
275,کتاب زندگی بر شاهراه قدیم رم,4.0,13000
276,کتاب بازگشت به خان نخست/هشتمین خان,4.0,13000
277,کتاب در ارتفاع شانه هایت برف می بارد,4.0,13000
278,کتاب سویه ها,4.0,14000
279,کتاب قواعد خوردن (راهنمای تغذیه سالم),4.0,14000
280,کتاب دیوار,4.0,14000
281,کتاب من ادواردو نیستم,4.0,14000
282,کتاب جایگاه اشتباه در نظام حقوق کیفری ایران,4.0,14000
283,کتاب سر بر تن و دنبال سرم می گردم,4.0,14000
284,کتاب اگر من یک دایناسور داشتم,4.0,14000
285,کتاب درآمدی بر مردم شناسی و انسان شناسی,4.0,14500
286,کتاب اتوبوس پاکستانی,4.0,14500
287,کتاب چشم شب,4.0,15000
288,کتاب آتشفشان ها,4.0,15000
289,کتاب داستان زال,4.0,15000
290,مکالمات کنفوسیوس,4.0,15000
291,کتاب ارواح اتاق زیر شیروانی,4.0,15000
292,کتاب دیوار نوشته های زندان قصر,4.0,15000
293,کتاب سایه های مرده بلوط,4.0,15000
294,کتاب پرنده ای به نام کاکاپو,4.0,15000
295,کتاب آینه ی سوم,4.0,15000
296,کتاب ماجرای باربد و شب خوابیدن توی اتاق خودش,4.0,15000
297,کتاب لاکی و خواب رنگی,4.0,15000
298,کتاب آخرین پر سیمرغ,4.0,16000
299,کتاب پیاده، از تجریش…,4.0,17000
300,کتاب نگاه گورگن,4.0,17000
301,کتاب مت میلیونر,4.0,17000
302,کتاب توپ لاستیکی,4.0,17000
303,کتاب رقصا,4.0,17000
304,کتاب در خم گیسوی دلتنگی,4.0,18000
305,کتاب واژه نامه علوم زمین,4.0,18000
306,کتاب گفتن در عین نگفتن,4.0,18000
307,کتاب همراهی نزدیکان در طول بیماری,4.0,18000
308,کتاب آخ جون دیگه فهمیدم!,4.0,18000
309,کتاب آدم برفی گمشده,4.0,18000
310,کتاب رنگ، بازی بازی، رنگ,4.0,18000
311,کتاب جنگاوران اخترناو,4.0,18500
312,کتاب کتاب کوچک ارواح,4.0,19000
313,کتاب مبانی سیاست خارجی تطبیقی,4.0,19000
314,آخرین ضربه آرشه,4.0,19500
315,کتاب لیبرالیسم غرب - ظهور و سقوط,4.0,19800
316,کتاب باری دیگر برایدزهد,4.0,19800
317,کتاب بچه پرروهای ننر,4.0,19800
318,بابا لنگ دراز,4.0,20000
319,کتاب خاکسپاری اسپوزیتو,4.0,20000
320,کتاب رقصی چنین میانه میدانم آرزوست,4.0,20000
321,منطق صوری به زبان ساده,4.0,20000
322,کتاب خمینی؛ پدیده انسانی پیچیده,4.0,20000
323,کتاب نامه ها جلد ۱,4.0,20000
324,کتاب منتخب مکالمات کنفوسیوس,4.0,20000
325,کتاب برخورد نزدیک از نوع آخر و سرخ و سوزان,4.0,20000
326,کتاب در مورد مساله مسکن,4.0,20000
327,کتاب ملاقات در سندیکای مومیاگران,4.0,20000
328,کتاب کسی در من شیطنت می کند,4.0,20000
329,کتاب پله های صعود,4.0,20000
330,کتاب نوئمی 8,4.0,20000
331,کتاب زبان نرم مار را از سوراخ بیرون می کشد,4.0,20000
332,کتاب ملانصرالدین و مرد نادان و یک حکایت دیگر,4.0,20000
333,کتاب مردم از گلوله ها بیشترند,4.0,20000
334,کتاب قصه های گوگولی برای بچه های گوگولی (6),4.0,20000
335,کتاب گاهی اوقات برای زنده ماندن باید مرد,4.0,20000
336,کتاب کدو قلقله زن,4.0,20000
337,کتاب سکولاریسم و دموکراسی در ترکیه,4.0,22000
338,کتاب نگاهی اجمالی به عصر زرین فرهنگ ایران,4.0,22000
339,کتاب شرح نهج البلاغه 3,4.0,22000
340,کتاب برنامه نویسی کنترل عددی,4.0,22000
341,کتاب این درس است یا بازی,4.0,22000
342,کتاب نیروانای ناممکن ما,4.0,22000
343,کتاب رویای هفت رنگ,4.0,22000
344,کتاب هیچی!,4.0,22000
345,کتاب یک وجب من,4.0,22000
346,کتاب از غربت، با عشق,4.0,22500
347,کتاب گفتارهایی درباره انقلاب اسلامی ایران,4.0,23000
348,کتاب عر و عرعره تره یا کره (جلد سخت),4.0,23000
349,کتاب برگزیده ی شعرهای سنایی,4.0,23000
350,کتاب پویایی نقد,4.0,24000
351,کتاب برای غرورمان بگرییم,4.0,24000
352,کتاب اسرار ماه رمضان,4.0,24500
353,کتاب یادگاری,4.0,25000
354,کتاب مغولان,4.0,25000
355,کتاب پیشدادیان و کیانیان,4.0,25000
356,کتاب مرد پشت روزنامه,4.0,25000
357,کتاب آتشفشان های داغ,4.0,25000
358,کتاب همدرد,4.0,25000
359,کتاب واقعیت سینما,4.0,25000
360,کتاب روز چهاردهم,3.99,1200
361,کتاب زمستان سبز,3.99,1700
362,کتاب شرق غمگین,3.99,1700
363,کتاب کاش کمی بزرگتر بودم,3.99,2500
364,کتاب کتاب سخنگو سی جزء سی قاری,3.99,2500
365,کتاب دفتر نقش 5,3.99,2900
366,کتاب آونگ گالیله,3.99,3000
367,اندرزهای کوچک زندگی (جلد 2),3.99,3200
368,کتاب عاشقی روی خط عابر پیاده,3.99,3500
369,کتاب انتخابات چرا؟ چگونه؟,3.99,4000
370,کتاب باغ وحش,3.99,4000
371,کتاب چه کاره باشی؟ می گم خدا اجازه، می رم توی مغازه,3.99,4000
372,کتاب دخترک، ماهی، تنهایی,3.99,4200
373,کتاب ابعاد اندیشه ورزی,3.99,4500
374,کتاب سایه های تردید,3.99,4700
375,کتاب غول حسود,3.99,5000
376,کتاب نحسی روز جمعه سیزدهم,3.99,5000
377,کتاب مادربزرگ و اسکی,3.99,5000
378,کتاب خانواده ی تت,3.99,5000
379,کتاب زنگ بهداشت,3.99,5000
380,کتاب مروری کوتاه بر تاریخ کتاب در ایران,3.99,5000
381,کتاب کره اسب یتیم,3.99,5000
382,کتاب تشنه در خاک,3.99,5500
383,کتاب دعوا نکنیم گفت و گو کنیم,3.99,6000
384,کتاب کار، کوشش، شادی,3.99,6000
385,کتاب از میان تارهای مرتعش,3.99,6000
386,کتاب الفبایم را جدی بگیر,3.99,6000
387,کتاب باغ پارسی,3.99,6000
388,کتاب قصه یه قصه,3.99,6500
389,کتاب خورشید بر شانه راستشان می تابید,3.99,6500
390,کتاب کتاب خاتم,3.99,7000
391,کتاب طوقی و موش زیرک,3.99,7000
392,کتاب بچه ها بیایید نمایش 1,3.99,7000
393,کتاب یک نامه عاشقانه سانسور شده,3.99,7000
394,کتاب شرلوک هلمز 17,3.99,7000
395,کتاب نقد تاریخ نگاری انقلاب اسلامی,3.99,7200
396,عیسی،پسر انسان,3.99,7500
397,کتاب جزء سی ام قرآن کریم,3.99,7500
398,کتاب تاریخ فخری,3.99,7500
399,قصه هایی از امام جواد (ع) 3,3.99,7500
400,کتاب پسر امپراطور یونجه برها,3.99,8000
401,کتاب رولت روسی,3.99,8000
402,کتاب یک قاچ هندوانه,3.99,8000
403,کتاب اینجا بهشت خداست,3.99,8000
404,کتاب تحقیقاتی درباره ساسانیان,3.99,8000
405,کتاب لحظه های بیتابی 2,3.99,8000
406,کتاب اولین دعاهای من,3.99,8000
407,کتاب فیلم نگاری یک داستان عاشقانه,3.99,8000
408,کتاب کتاب اصفهان,3.99,8000
409,کتاب بهزراعی غلات,3.99,8000
410,کتاب هدیه تولدی که داستان شد,3.99,8500
411,استنلی کوبریک,3.99,8500
412,کتاب چای سرد,3.99,8500
413,کتاب آقلاما,3.99,8500
414,کتاب حاضرم باهات شرط ببندم!,3.99,9000
415,کتاب مطلقا آبی,3.99,9000
416,کتاب دست هایت کولی ها را آواره می کنند,3.99,9000
417,کتاب پی پر به دکتر می رود,3.99,9500
418,کتاب راهنمای سیستم تجارت جهانی,3.99,9500
419,کتاب استرس و روش های مقابله,3.99,10000
420,کتاب به دنیا آمده ام تا عاشق تو باشم,3.99,10000
421,کتاب تاویل صفات خدا,3.99,10000
422,گلشن راز,3.99,10000
423,کتاب قدرت‏ شما در اختیار شما,3.99,10000
424,کتاب پارادایم کثرت گرا,3.99,10000
425,کتاب دعا کنید سطرهای عاشقانه از یادمان نرود,3.99,10000
426,کتاب قرمز جدی,3.99,10000
427,کتاب دو قلوها به دکتر می روند,3.99,10000
428,کتاب آنچه نامش را ”تو” نامیدم,3.99,10000
429,کتاب عقرب و مرد جوان,3.99,10000
430,کتاب قضیه ی فیل و فنجان,3.99,10500
431,کتاب ابراهیم در آتش,3.99,10500
432,کتاب نشانه شناسی مکان,3.99,11000
433,کتاب النگوی یاقوت,3.99,11000
434,کتاب عشق آباد,3.99,11000
435,کتاب کریستبل,3.99,11500
436,کتاب با کمی خلاقیت منظم شو,3.99,11500
437,کتاب دفترهای سالخوردگی 1,3.99,11500
438,کتاب تن پروری,3.99,12000
439,کتاب سرایت,3.99,12000
440,کتاب درباره افسردگی,3.99,12000
441,کتاب کوتاه ترین راه در نوازندگی پیانو,3.99,12000
442,کتاب کی بود چی بود از راه رسید,3.99,12000
443,کتاب عمه گیلاس 2,3.99,12000
444,کتاب من آلکس کراس هستم,3.99,12000
445,کتاب هوای خانه عطر می زند,3.99,12000
446,کتاب جوانی,3.99,12000
447,کتاب رویای چگوارا در قلب من می روید,3.99,12000
448,کتاب خودکشی برای خداوند,3.99,12000
449,خوابیدن، مثل ببر!,3.99,12000
450,کتاب فلسفه ی دانالد دیویدسن,3.99,12500
451,هدیه,3.99,12900
452,کتاب دالسی,3.99,13000
453,کتاب عفاف و حجاب در سبک زندگی ایرانی اسلامی,3.99,13000
454,کتاب خورشید,3.99,13000
455,کتاب آموزش عالی و جامعه,3.99,13000
456,کتاب بینایی,3.99,13000
457,کتاب خشت خام,3.99,13500
458,کتاب ویتگنشتاین ایمان گرایی و عقل گریزی,3.99,13500
459,کتاب تنباکوها و یاس ها,3.99,13500
460,کتاب قرآن کریم و قانون جذب,3.99,14000
461,کتاب انتخاب,3.99,14000
462,کتاب صحیفه کاظمیه,3.99,14000
463,کتاب ماجراهای نانسی درو (6),3.99,14000
464,کتاب ساعت ستاره,3.99,14000
465,کتاب سنگر دوست داشتنی,3.99,14000
466,کتاب محبت الهی,3.99,14000
467,کتاب جراحت,3.99,14000
468,کتاب جدایی بابا داینا و مامان داینو,3.99,15000
469,کتاب چارخانه و خاله کشمشی,3.99,15000
470,مادر پسر,3.99,15000
471,کتاب ماهی دم قرمزی,3.99,15000
