,title,rating,price
3583,کتاب یک گربه بود هلپ و تلپ,3.85,15000
3584,کتاب درخت گردو,3.85,15000
3585,کتاب من، آیدا و خانه ی زنگوله ای,3.85,15000
3586,کتاب خداحافظ پدر,3.85,15000
3587,کتاب بندهایم را به آب بده,3.85,15000
3588,کتاب ترانه های گمشده درکوچه های باد,3.85,15000
3589,کتاب سفید برفی و هفت کوتوله,3.85,15000
3590,کتاب مادرها مهربون اند,3.85,15900
3591,کتاب دفتر خاطرات یک نینجای کلاس ششمی 1,3.85,16000
3592,نگاهی به زندگی و آثار چخوف,3.85,16000
3593,کتاب ناگزیر,3.85,16000
3594,کتاب مبانی ارتباطات,3.85,17000
3595,کتاب یک مسواک و یک دندان,3.85,17000
3596,کتاب بهار بود و زمستان,3.85,17000
3597,کتاب سنجاب شکمو,3.85,17000
3598,کتاب یک جعبه پیتزا برای ذوزنقه‎ ی کباب شده,3.85,17000
3599,کتاب کشت بافت درختان,3.85,17500
3600,کتاب پاوه سرخ,3.85,18000
3601,کتاب کارآفرینی سازمانی,3.85,18000
3602,کتاب دنیا هدیه می خواهد,3.85,18000
3603,کتاب 50 ایده مهم درباره آینده که شما باید بدانید,3.85,18000
3604,کتاب آوازهای آبی,3.85,18000
3605,کتاب دخترک پشت دیوار,3.85,18000
3606,کتاب آشنایی با ورزش ها,3.85,18500
3607,کتاب هنر و سبک های نثر عربی,3.85,18500
3608,کتاب شایعاتی درباره جایی بهتر,3.85,18500
3609,کتاب صعود مقاومت پذیر آقای م.ر حساس,3.85,19000
3610,کتاب جادوی سودوکو,3.85,19000
3611,اینگونه می توانید,3.85,20000
3612,کتاب گمشدگان - کتاب اول,3.85,20000
3613,کتاب ریاضی با موشی 7,3.85,20000
3614,کتاب هنر ایرانی,3.85,20000
3615,کتاب ناخوانده,3.85,20000
3616,کتاب سلطان نیل,3.85,20000
3617,کتاب جنگل شیطونک ها,3.85,20000
3618,کتاب فرایند برنامه ریزی,3.85,20000
3619,کتاب مرد بی چهره,3.85,20000
3620,نگاهی به مفاهیم بنیادی عکاسی,3.85,20000
3621,ماز بازی 2,3.85,20000
3622,کتاب سه روز برای دیدن,3.85,20000
3623,مده‎ آ,3.85,20000
3624,کتاب قدرت و سیاست فرهنگی در روابط بین الملل,3.85,20000
3625,کتاب دریا پشت ایستگاه قطار است,3.85,20000
3626,خوشبختانه شیر,3.85,20000
3627,کتاب صاحب دل,3.85,20000
3628,با مشکل خود چه می کنید؟,3.85,20000
3629,کتاب نقطه ای بر سر دال,3.85,20000
3630,کتاب مارتین لوتر کینگ,3.85,20000
3631,کتاب تمساح گمشده,3.85,20000
3632,کتاب برادر سهراب,3.85,20000
3633,کتاب اگر زمین مثل سیب زمینی چروکیده شود!,3.85,20000
3634,کتاب گیو و کیخسرو,3.85,20000
3635,کتاب رستم و اسفندیار,3.85,20000
3636,کتاب بهلول و داروغه و یک حکایت دیگر,3.85,20000
3637,کتاب چراغ صبح,3.85,20000
3638,کتاب کمی ادب بد نیست,3.85,20000
3639,کتاب اقیانوس ها چرخ می زنند,3.85,20000
3640,دختر نارنج و ترنج و پسر کوه نشین,3.85,20000
3641,آپولین راننده می شود,3.85,20000
3642,کتاب تحلیل تکنیکال بنیادی و روش های معاملاتی,3.85,20000
3643,کتاب برتری در تجارت,3.85,20000
3644,کتاب ماشین های امداد,3.85,20000
3645,فکر کن رنگ کن 15,3.85,20000
3646,کتاب خونه ی کی تو دریاست؟ (حیوانات دریا),3.85,20000
3647,کتاب مسابقه دات کام,3.85,21000
3648,کتاب آرش و تهمینه,3.85,21000
3649,کتاب فلسفه هنر رایانه ای,3.85,21000
3650,کتاب از نخلستان تا خیابان,3.85,21000
3651,کتاب مدیر آموزش الکترونیکی,3.85,21000
3652,کتاب تفرجی از سر ناشکیبایی,3.85,22000
3653,کتاب چرا از اوانس نپرسیدند,3.85,22000
3654,کتاب گالیله,3.85,22000
3655,کتاب منوچهری,3.85,22000
3656,مهر هر کسی به دل بیفتد دل مال اوست,3.85,22000
3657,کتاب جزیره توهم,3.85,22000
3658,کتاب نی نی آدم و نی نی فیلی,3.85,22000
3659,کتاب نمایشنامه این جا گواتمالاست,3.85,22000
3660,کتاب بگرد و پیدا کن,3.85,22000
3661,کتاب مدیریت دانشگاهها و موسسات آموزش عالی,3.85,22000
3662,کتاب گربه چکمه پوش,3.85,22000
3663,کتاب مبانی تغذیه گیاه,3.85,22400
3664,کتاب این مرگ آرایش گر است,3.85,22500
3665,کتاب احیا و جهانی شدن اقتصاد ملی,3.85,22500
3666,کتاب تپلی عصبانی می شود,3.85,23000
3667,کتاب جاده سنگی صلح,3.85,23000
3668,کتاب پیش پرده و پیش پرده خوانی در ایران,3.85,24000
3669,کتاب ساخت آوایی زبان,3.85,24000
3670,کتاب عاشورا و رهایی,3.85,24000
3671,کتاب کلاغ سیاه,3.85,24000
3672,کتاب چهره به چهره,3.85,25000
3673,کتاب دختری از جنس پاییز,3.85,25000
3674,کتاب ساخت گرایی، نشانه شناسی سینما,3.85,25000
3675,کتاب روش نوین مبانی اجرای موسیقی,3.85,25000
3676,کتاب توپک خوش بینی,3.85,25000
3677,کتاب ده میلیون لیوان آب می شود خیلی!,3.85,25000
3678,کتاب ماجرای باور نکردنی تابستان من,3.85,25000
3679,کتاب حسابداری و مدیریت مالی برای مدیران غیر مالی,3.85,25000
3680,کتاب دل شکسته,3.84,1500
3681,کتاب دارالعلم های شیعی,3.84,1600
3682,کتاب هفت,3.84,1800
3683,کتاب سفر خاک,3.84,2200
3684,کتاب جوجه تیغی,3.84,2400
3685,کتاب بدشانسی خوش شانسی,3.84,2500
3686,کتاب برگزیده شعرهای سهراب سپهری,3.84,2500
3687,کتاب ننگ,3.84,2500
3688,کتاب جدائی گفت و گو,3.84,3000
3689,ماجراهای بابا مومین,3.84,3200
3690,خانه ی خانم معلم,3.84,3500
3691,کتاب آموزش رهایی از اضطراب,3.84,3500
3692,کتاب روشنفکر میهنی,3.84,4000
3693,کتاب به وقت گفتن,3.84,4500
3694,کتاب مترسک عاشق بود,3.84,4500
3695,مسافری از آینده,3.84,4500
3696,کتاب فراسوی شفای زندگی,3.84,5000
3697,کتاب وقف از دیدگاه حقوق و قوانین,3.84,5000
3698,کتاب مشاهیر کتابشناسی معاصر ایران (19),3.84,5000
3699,کتاب تیترهای درشت سیاه ترند,3.84,5200
3700,کتاب در سایه اشیاء,3.84,5500
3701,کتاب باز با باران,3.84,5700
3702,کتاب گام نخست، رهیدن از قانونهای کهنه,3.84,5900
3703,کتاب ماهی گیر و غول خمره,3.84,6000
3704,کتاب عبور از حلقه از 7:15 تا 8,3.84,6000
3705,کتاب پوشش ریسک در مالی اسلامی,3.84,6000
3706,کتاب اتحادیه اروپا هویت امنیت و سیاست,3.84,6000
3707,کتاب مدارک جعلی,3.84,6000
3708,کتاب دانشمندان بزرگ,3.84,6000
3709,کتاب خانه ی اشباح,3.84,6000
3710,کتاب زمین چرخید آدم چرخید,3.84,6000
3711,کتاب برج بلند فرعون,3.84,6000
3712,کتاب ماجرای نبرد خیبر,3.84,6000
3713,کتاب مادرجون! چرا اسمم یادت رفته؟!,3.84,6500
3714,کتاب کشتی سرگردان در مه دریا,3.84,6500
3715,کتاب عاشورا,3.84,6500
3716,کتاب افسون شوم پروانه,3.84,7000
3717,کتاب پول برای زندگی,3.84,7000
3718,کتاب من می میرم اما یادها می ماند,3.84,7000
3719,دانلد داک 5,3.84,7000
3720,کتاب در ستایش بیداری,3.84,7000
3721,گام به گام با رایانه 4,3.84,7000
3722,ایران و عثمانی در آستانه قرن بیستم(جلد دوم),3.84,7500
3723,کتاب یه کار تر و تمیز,3.84,7500
3724,کتاب گروه شبنم,3.84,7500
3725,کتاب وقتی تاریخ آلزایمر می گیرد,3.84,7800
3726,کتاب چشمان منتظرم,3.84,8000
3727,کتاب جادوگردی در پس چهره هری پاتر,3.84,8000
3728,کتاب حیوانات دست آموز,3.84,8000
3729,کتاب در بیشه,3.84,8000
3730,کتاب مجسمه ها,3.84,8000
3731,کتاب رباعی های عاشقانه برای تو,3.84,8000
3732,کتاب روزنامه سقفی همشاگردی,3.84,8000
3733,کتاب ماه هفت شب,3.84,8000
3734,کتاب رفیق پانجونی,3.84,8000
3735,کتاب ماهیان خاکزی,3.84,8000
3736,کتاب کردها پرچمداران ادب فارسی در ایران و میانرودان,3.84,8000
3737,کتاب مثل فلوکستین های بیست,3.84,8000
3738,کتاب ما کنجکاویم,3.84,8000
3739,کتاب مدیریت شهری و خانواده,3.84,8000
3740,کتاب شیر,3.84,8000
3741,کتاب از یاد رفتن,3.84,8500
3742,کتاب پرزنت های 45 ثانیه ای برای موفقیت در بازاریابی شبکه ای,3.84,8500
3743,فلسفه تحلیلی,3.84,9000
3744,کتاب آغوش حروف آهسته آزادی,3.84,9000
3745,کتاب عشق خداست,3.84,9000
3746,کتاب زلال حکمت - جلد دوم,3.84,9000
3747,کتاب سحرگاه با شیطان,3.84,9000
3748,کتاب قورقوری,3.84,9000
3749,آیا واقعا به خوابیدن نیاز دارم؟,3.84,9500
3750,کتاب لطفا به من نخندید,3.84,9500
3751,ابریشم,3.84,9500
3752,قصه هایی از امام زمان (عج) 4,3.84,10000
3753,کتاب گزیده ای از معروف ترین اشعار جیوزپه اونگرتی,3.84,10000
3754,کتاب تماشای خورشید,3.84,10000
3755,کتاب ماده شیر سفید,3.84,10000
3756,کتاب سفرنامه تاجیکستان‮‮,3.84,10000
3757,کتاب ستاره ای برای من,3.84,10000
3758,تلاش بیهوده عشق,3.84,10000
3759,کتاب کیوگن,3.84,10000
3760,می خواهم کلاهم را پس بگیرم,3.84,10000
3761,کتاب مثنوی یوسف و زلیخا,3.84,10000
3762,کتاب بهادر,3.84,10000
3763,کتاب چیستان های علمی,3.84,10000
3764,کتاب شکوفایی شخصیت,3.84,10000
3765,کتاب دستور خط زبان گفتار فارسی,3.84,10000
3766,حکمت در دوران شکوفای فکری یونانیان,3.84,11000
3767,کتاب موسیقی نواحی جان,3.84,11500
3768,کتاب میرزا روبات,3.84,12000
3769,کتاب برونو مونگوتزی,3.84,12000
3770,کتاب امام حسین پژوهی,3.84,12000
3771,کتاب در اعماق قلب من,3.84,12000
3772,کتاب کوران,3.84,12000
3773,کتاب امام محمد باقر (ع),3.84,12000
3774,کتاب زیارت,3.84,12500
3775,کتاب عدالت استخدامی,3.84,12500
3776,کتاب ساعت آفتابی,3.84,13000
3777,کتاب اجلاس جهانی سران درباره جامعه اطلاعاتی,3.84,13000
3778,شمعدانی عطری,3.84,13000
3779,کتاب زندگی با چشم های بسته آسان است,3.84,13000
3780,کتاب روز جغد/یک داستان ساده,3.84,13500
3781,کتاب نانوسیالات,3.84,13500
3782,کتاب مجموعه ای از آثار گرافیک مذهبی,3.84,13900
3783,کتاب این لحظه ها را دوست دارم,3.84,14000
3784,کتاب داستان های اوا لونا,3.84,14000
3785,کتاب زنان، شهر و شهرسازی,3.84,14000
3786,کتاب تاریخچه مصور الفبا و خط,3.84,14000
3787,کتاب بازی با بچه ها,3.84,14000
3788,کتاب زبان شناسی ایرانی,3.84,14500
3789,کتاب صور اسرافیل,3.84,15000
3790,کتاب از ماست,3.84,15000
3791,کتاب لحظه های بیتابی,3.84,15000
3792,کتاب نردبان اندر بیابان,3.84,15000
3793,کتاب عروج کیخسرو,3.84,15000
3794,کتاب پنجره ای رو به سوی دیروز,3.84,15000
3795,کتاب درمانگاه احساسات,3.84,15000
3796,نظارت دقیق قطارها,3.84,15000
3797,کتاب آنقدرها هم سرم شلوغ نیست,3.84,15000
3798,دوست داشتن از عشق برتر است,3.84,15000
3799,نظریه کوانتوم,3.84,15000
3800,کتاب حواستون به پیرزن هایی که از تنهایی پوسیده ن باشه,3.84,15000
3801,کتاب حدیث شوق,3.84,15000
3802,کتاب خانواده شاد,3.84,15000
3803,کتاب شب بخیر مامان,3.84,15000
3804,کتاب ماجراهای خرسی و سنجاب,3.84,15000
3805,کتاب نی نی میگه صبح بخیر,3.84,15000
3806,کتاب نشانی شعر,3.84,15000
3807,کتاب موسی (ع),3.84,15000
3808,کتاب رزی و موسی : نامه پدر,3.84,15000
3809,کتاب بازی و آموزش حساب,3.84,15000
3810,کتاب داستان نانو تروا,3.84,16000
3811,کتاب فرشتگانی در سوی درون,3.84,16000
3812,کتاب سلامتی با تغذیه صحیح,3.84,16000
3813,کتاب مسیر خود را به سوی رشد بازاریابی کنید,3.84,16000
3814,کتاب آن پنهان,3.84,16500
3815,کتاب کیفیت زندگی شهری,3.84,16900
3816,کتاب خاشخاشی با الف,3.84,17000
3817,کتاب برش بزن، بچسبون,3.84,17000
3818,کتاب شوآن,3.84,17000
3819,کتاب کاربرد گیاهان شور زیست در تغذیه نشخوارکنندگان,3.84,17000
3820,کتاب فصول منتزعه,3.84,17500
3821,کتاب رویکرد انتقادی در جامعه شناسی ادبیات,3.84,18000
3822,کتاب وقت خواب خرس,3.84,18000
3823,کتاب اردی بهشت نام دیگر توست,3.84,18000
3824,کتاب معماری و شهرسازی در قرن بیستم,3.84,18000
3825,کتاب سرمایه اجتماعی و نظریه اجتماعی,3.84,18000
3826,کتاب برای اولین بار: بیا مسابقه بدهیم,3.84,18000
3827,کتاب در مایه های ایرانی,3.84,18000
3828,کتاب سوء استفاده از حق,3.84,18000
3829,کتاب بابای الفی اتکینز خوب فکر می کند,3.84,18000
3830,کتاب خواب کفش,3.84,18000
3831,کتاب عهد نسیم,3.84,18000
3832,کتاب مه,3.84,18500
3833,کتاب تذکره اربیل,3.84,18500
3834,کتاب نگاهی فقهی به قراردادهای مضاربه و جعاله بانکی,3.84,18500
3835,کتاب چشم های تو روشن بود,3.84,19000
3836,کتاب مری را دیده اید؟,3.84,19000
3837,کتاب ازدواج و خانواده,3.84,19000
3838,کتاب شرح دعای ندبه (2 جلدی),3.84,19000
3839,کتاب متیان جان,3.84,19000
3840,کتاب آلام,3.84,19500
3841,کتاب پالپ دندان,3.84,19500
3842,کتاب مقدمه کیمبریج بر ساموئل بکت,3.84,20000
3843,کتاب فروم در کلام خودش,3.84,20000
3844,کتاب هنر و ارزش,3.84,20000
3845,کتاب عرفان و منطق,3.84,20000
3846,کتاب دژخیم,3.84,20000
3847,کتاب امام خمینی (ره),3.84,20000
3848,کتاب نیکی و هدیه ی معرکه ی روز تولد,3.84,20000
3849,اسفار کاتبان,3.84,20000
3850,ضحاک (نابینایان),3.84,20000
3851,کتاب چند سال بعد,3.84,20000
3852,کتاب فقط بیا,3.84,20000
3853,کتاب قصه های تصویری از پروین اعتصامی 12,3.84,20000
3854,کتاب روشنفکر و مسئولیت او در جامعه,3.84,20000
3855,کتاب نامه ها و ملاقات ها,3.84,20000
3856,کتاب عملیات سری کشک,3.84,20000
3857,کتاب دن لیو,3.84,20000
3858,برف,3.84,20000
3859,کتاب خواب عجیب,3.84,20000
3860,کتاب آموزش کاربردی Windows 8.1,3.84,20000
3861,زنگ نقاشی 4,3.84,20000
3862,فکر کن رنگ کن 5,3.84,20000
3863,کتاب خاطرات یک کلاه,3.84,20000
3864,کتاب خونه ی کی صحرا است؟ (خزندگان),3.84,20000
3865,کتاب بررسی موسیقی در آیین مهر,3.84,20000
3866,کتاب در دست انتشار,3.84,21000
3867,کتاب اخترفیزیک برای رصدگران,3.84,21500
3868,کتاب الهه ی خاموش معبد,3.84,22000
3869,کتاب برنج,3.84,22000
3870,کتاب مرگ مناسب,3.84,22000
3871,کتاب درمان سوء مصرف مواد,3.84,22800
3872,کلید طلایی ثروت,3.84,22900
3873,کتاب شرح اشارات و تنبیهات,3.84,23000
3874,کتاب روشهای کاربردی توسعه صادرات از طریق شبکه های مجازی,3.84,23000
3875,کتاب ناپدیدشدن ادل بودو,3.84,23000
3876,کتاب مباحثی پیرامون عزاداری,3.84,23000
3877,زن کامل,3.84,23000
3878,کتاب ریاضی و سودوکوهای ساده,3.84,23000
3879,کتاب بایسته های اخلاق مهندسی,3.84,24000
3880,کتاب ذهن فعال پیشرفته 5,3.84,24000
3881,کتاب حضرت خضر علیه السلام,3.84,24000
3882,کتاب نقاب,3.84,24000
3883,کتاب پلید,3.84,24000
3884,کتاب طبیعت پیمایی بی ردپا,3.84,24000
3885,درباره سرشت انسان,3.84,24000
3886,کتاب نشانه شناسی فیلم های مستند دفاع مقدس,3.84,24000
3887,کتاب خانه تعطیلات,3.84,24000
3888,کتاب بامشی پیشی و دردسرهایش 8,3.84,24000
3889,کتاب زیر سایه درخت بیعار,3.84,24000
3890,کتاب از شیدایی تا جدایی,3.84,24000
3891,ژرفای پوست,3.84,25000
3892,کتاب اخلاق خلاق,3.84,25000
3893,کتاب موشی و خودش,3.84,25000
3894,کتاب جمیله,3.84,25000
3895,کتاب کتیبه های محبت,3.84,25000
3896,کتاب ستاره ناهید,3.83,2000
3897,کتاب بچه تمساح کجا رفت؟,3.83,2500
3898,کتاب لاک پشت و خرگوش,3.83,2500
3899,کتاب کتاب کوچک از عارفان بزرگ,3.83,3000
3900,تمرین خردسالان (2),3.83,3000
3901,کتاب پژوهشگونه ای درباره مصحف فاطمه (س ),3.83,3000
3902,دور ماه,3.83,3500
3903,کتاب این پرنده از دوران سلجوقیان آمده است,3.83,3600
3904,کتاب کفش توری گل بلوری,3.83,3700
3905,کتاب همه ی انگشت هایم اشاره اند,3.83,3800
3906,کیک پرنده,3.83,4000
3907,کتاب ابوذر غفاری,3.83,4000
3908,قصه گویی (8),3.83,4000
3909,کتاب چند روز، همه ی ما,3.83,4000
3910,کتاب متولد محله سه انگشتی ها,3.83,4000
3911,کتاب بهت زدگی,3.83,4500
3912,کتاب فلسفه تفسیری حقوق,3.83,4500
3913,کتاب فروشنده ی پیشرو,3.83,4900
3914,کتاب سی ساغر سحری,3.83,4900
3915,کتاب ماه را به هیچ کس نمی دهم,3.83,5000
3916,کتاب ریشه های شفابخش,3.83,5000
3917,کتاب با دستان خالی به دنیا آمده ایم,3.83,5000
3918,کتاب دیرینه شناسی گیاهی,3.83,5000
3919,کتاب ساخت اضافه در زبانهای ایرانی,3.83,5500
3920,کتاب تاریخ یزد,3.83,5500
3921,کتاب از گونه ای دیگر,3.83,5800
3922,کتاب کنودونتها,3.83,5800
3923,کتاب ما یک سر و گردن از تفنگ ها بلندتریم,3.83,5800
3924,کتاب عام و خاص در اخلاق,3.83,6000
3925,کتاب شاهد خاموش,3.83,6000
3926,کتاب سیگنال ها و سیستم ها,3.83,6000
3927,کتاب عشق من:حامد بهداد,3.83,6500
3928,کتاب نبردهای تن به تن ایرانیان با تورانیان,3.83,6500
3929,کتاب یک نفر تو را دوست دارد 4,3.83,6500
3930,کتاب عینک طلایی,3.83,7000
3931,کتاب هفت داستان,3.83,7000
3932,کتاب کاترینا توفان مورد علاقه ی من است,3.83,7000
3933,کتاب دماوند گب آوند,3.83,7000
3934,کتاب من آذر هستم,3.83,7000
3935,کتاب پله های بی تو,3.83,7000
3936,کتاب شرلوک هلمز 7,3.83,7000
3937,ولگردها,3.83,7500
3938,برای این که در محله گم نشی,3.83,7500
3939,کتاب شط رنج,3.83,7500
3940,کتاب بگو سیب,3.83,8000
3941,کتاب چارلی,3.83,8000
3942,کتاب دو متر در دو متر جنگ,3.83,8000
3943,کتاب حسرت حرف های نگفته,3.83,8000
3944,کتاب عشای ربانی ملحدان,3.83,8000
3945,کتاب عجب دسته گلی بر آب دادی,3.83,8500
3946,چه کسی نخ ماه را نگه می دارد؟,3.83,8500
3947,کتاب عناصر خودسر,3.83,8500
3948,کتاب دو فصل تلخ,3.83,8500
3949,کتاب چگونه می توان یک فیل را تربیت کرد؟,3.83,9000
3950,کتاب دیواب,3.83,9000
3951,کتاب میثاق نامه مکتب حاج قاسم,3.83,9000
3952,کتاب کودتآه,3.83,9000
3953,کتاب طرف تاریکی,3.83,9000
3954,کتاب بغض های نارس,3.83,9000
3955,کتاب فانوس حرم,3.83,9500
3956,گذار روزگار,3.83,9500
3957,پین بال 1973,3.83,9500
3958,کتاب روشهای پژوهش در علوم اجتماعی,3.83,9500
3959,کتاب پرورش هوش هیجانی در پسران,3.83,9900
3960,کتاب دریچه ای به دنیای شگرف سپاس گزاری,3.83,9900
3961,کتاب مهربان تر از مادر,3.83,10000
3962,کتاب افسون معبد سوخته,3.83,10000
3963,کتاب سفید برفی و هفت کوتوله,3.83,10000
3964,کتاب تاریخ نماز در اسلام,3.83,10000
3965,کتاب ملاقات در سامرا,3.83,10000
3966,کتاب نظریه شناخت اسپینوزا,3.83,10000
3967,کتاب حسنی و خاله سرما 5,3.83,10000
3968,کتاب پنجره ای به دیروز,3.83,10000
3969,کتاب وقتی حیوانات باسواد می شوند,3.83,10000
3970,کتاب علم در یونان باستان,3.83,10000
3971,کتاب خرچنگ های غول پیکر,3.83,10000
3972,کتاب بچه ها بهار را صدا کنید,3.83,10000
3973,کتاب تأملی دیگر در قرآن و تفسیر,3.83,10000
3974,کتاب نقاب,3.83,10000
3975,کتاب دیدار با پروفسور داتی,3.83,10000
3976,کتاب مواد اطراف ما,3.83,10000
3977,کتاب بررسی تطبیقی حضرات وجود و انسان کامل در آثار بیدل دهلوی و ابن عربی,3.83,10800
3978,کتاب گوشه نشین,3.83,11000
3979,کتاب خیاط,3.83,11000
3980,کتاب مسخره بازی ها,3.83,11000
3981,کتاب ارواح,3.83,11000
3982,کتاب شش شخصیت در جست و جوی نویسنده,3.83,11000
3983,یک سوپر استار بازاریابی شبکه ای باشید,3.83,11000
3984,کتاب نورگیر,3.83,12000
3985,کتاب فرسنامه قیم نهاوندی,3.83,12000
3986,کتاب فنگ شویی,3.83,12000
3987,کتاب رژیم زیبایی,3.83,12000
3988,کتاب سنجاب ها,3.83,12000
3989,کتاب آدم محتاط .!.,3.83,12000
3990,کتاب سی و هفت و نیم,3.83,12000
3991,کتاب محاکمه ی دولت آمریکا,3.83,12000
3992,کتاب اسد، پسری که شیر شد,3.83,12000
3993,کتاب پانی می گه می بینی، بو می کشم با بینی,3.83,12000
3994,کتاب زندگی پیامبر,3.83,12000
3995,کتاب رابعه رباعی باران,3.83,12000
3996,کتاب عاشقانه های یک ویراستار,3.83,12000
3997,کتاب لحظه,3.83,12000
3998,کتاب دانش آموزان دیرآموز و مشکلات آموزشی,3.83,12500
3999,کتاب 	قاب عکس آفتاب,3.83,12500
4000,کتاب گربه های نادان و میمون زرنگ,3.83,12500
4001,کتاب مراد دل,3.83,13000
4002,کتاب Zal and the phoenix,3.83,13000
4003,کتاب دم دمای تو,3.83,13000
4004,کتاب مادرم زنی زیبا بود,3.83,13000
4005,کتاب لذت بهت زدگی در شعر محمدعلی بهمنی,3.83,13000
4006,کتاب ارتباط با خدا (1) نماز ها، ادعیه، زیارات,3.83,13500
4007,کتاب غنچه یاس کبود,3.83,13500
4008,کتاب مقامات حمیدی,3.83,14000
4009,کتاب پنجره زیرزمین,3.83,14000
4010,کتاب کاش شادی ام پایدار باشد,3.83,14000
4011,کتاب بچه ها کمک کنید!,3.83,14000
4012,کتاب دوست شو با خاک و آب,3.83,14000
4013,کتاب گرسنگی و ابریشم,3.83,14500
4014,کتاب دور از من,3.83,14500
4015,کتاب قطب نمای درون,3.83,15000
4016,کتاب پیش از ناشتایی,3.83,15000
4017,کتاب بعد از انقلاب,3.83,15000
4018,کتاب جغد مینروا,3.83,15000
4019,کتاب کلید کوچولو,3.83,15000
4020,کتاب دوست,3.83,15000
4021,کتاب محمد (ص),3.83,15000
4022,کتاب معمای رهایی ذهن,3.83,15000
4023,کتاب داستان های فانتزی و تمثیلی (9),3.83,15000
4024,کتاب افسانه‎ های ایرانی - جلد 3,3.83,15000
4025,کتاب دلفین,3.83,15000
4026,کتاب کیتی دکتر می شود,3.83,15000
4027,کتاب وای خدا جون!نی نی من تکون خورد,3.83,15000
4028,آیزاک نیوتن کی بود؟,3.83,15000
4029,کتاب زندگی پر فراز و نشیب یک قوطی کنسرو,3.83,15000
4030,کتاب مردان ارانوسی اند، زنان زمینی,3.83,15000
4031,کتاب امام موسی کاظم (ع),3.83,15000
4032,کتاب زن زیبایی که به ماه پرواز می کند,3.83,15000
